twitter_id,original_text,slug,party_slug,party_original,toxic_original,very_toxic_original,most_toxic_party,most_toxic_party_toxicity,most_verytoxic_party,most_verytoxic_party_toxicity,PARTIDO_toxic,PARTIDO_verytoxic
1420388174019403779,"Gran noticia: gracias a Cs, la Fiscalía investiga el aval con el que la Generalitat quiere sufragar la malversación de los condenados.

De nuevo hacemos lo que no hace el Gobierno de España: defender a los constitucionalistas de los atropellos separatistas.https://t.co/FCm4WAujdM",ines-arrimadas-garcia,ciudadanos,Cs,0.9705215692520142,0.010316637344658375,VOX,0.9784390330314636,VOX,0.015293316915631294,0.9692625999450684,0.009397471323609352
1420389883806367746,Otra vez @CiudadanosCs. Es normal que el secesionismo siga obsesionado con nuestra desaparición. https://t.co/6Fiwc1spCg,guillermo-diaz-gomez,ciudadanos,Cs,0.9932360053062439,0.09761779010295868,PODEMOS,0.996212363243103,PODEMOS,0.44883397221565247,0.9936366081237793,0.11651002615690231
1421011934183313412,"Las declaraciones sobre “escupitajos” y “cortes de mangas” de Arrimadas no deberían sorprendernos mucho.

Cs no será recordado ni por aportaciones profundas ni por buena educación. https://t.co/fV3vdjQ9tv",arnau-ramirez-carner,psoe,Cs,0.9882946014404297,0.04793381690979004,Ciudadanos,0.9930423498153687,Ciudadanos,0.1801738440990448,0.9924417734146118,0.08484974503517151
1421070083737243656,"Un ministro de Interior del PP, a juicio oral por haber usado recursos del Estado para tapar escándalos de su partido. Gravísimas conclusiones del caso Kitchen.

Cs volverá a llevar al Congreso la ley Anticorrupción y esperamos que quienes hoy se alarman -y con razón- la apoyen👇🏻 https://t.co/FOCuVZ19rx",,,Cs,0.050751037895679474,0.0007081762887537479,VOX,0.2847929000854492,VOX,0.0008523209253326058,0.21161633729934692,0.0007335570408031344
1421431098450587653,"Si no hay un tipo más grande que mi compañero y amigo ⁦@GuillermoDiazCs⁩ se dice y punto.

Derecha e izquierda se empeñan en decir no cómo debemos vivir nuestras vidas. El liberal no debe traspasar nunca la puerta de la casa de la gente.  https://t.co/JZ6gG01VUu",maria-munoz-vidal,ciudadanos,Cs,0.12141324579715729,0.0008812575251795352,Unidas Podemos,0.43464723229408264,Unidas Podemos,0.0011787657858803868,0.20678918063640594,0.0009270787704735994
1421580671164821505,"Si el separatismo está crecido es porque el Gobierno se lo permite. Llevamos décadas de cesiones al nacionalismo, pero Sánchez ha cruzado toda línea roja dándoles la impunidad, y lo que es peor, la razón. Cs siempre se opondrá a esta indignidad.

Mi entrevista en @europapress👇🏻 https://t.co/ew76Zc2GGk",ines-arrimadas-garcia,ciudadanos,Cs,0.9847112894058228,0.021011751145124435,VOX,0.9876720905303955,PODEMOS,0.030698958784341812,0.9837818145751953,0.016969576478004456
1421816660663603204,"En la España multi-nivel de Sánchez, él manda, quienes cumplen acatan y los nacionalistas siempre ganan.

En vez de criterios técnicos, priman los privilegios a quienes le mantienen en Moncloa. Cs siempre defenderá con hechos la igualdad entre españoles🇪🇸

https://t.co/DN7sZLxoor",,,Cs,0.956448495388031,0.006413184572011232,VOX,0.9714133739471436,VOX,0.009577475488185883,0.9488074779510498,0.005700904875993729
1422145036691574790,"Andalucía tiene un buen Gobierno de coalición. 

Además las consejerías de Empleo, Turismo y Economía de Andalucía están en manos de grandes equipos. Equipos, por cierto, de @Cs_Andalucia.

Aunque la clave, el elemento esencial, era creer en los andaluces. https://t.co/GZ8sj9Vz4m",guillermo-diaz-gomez,ciudadanos,Cs,0.010087135247886181,0.001326016616076231,Partido popular,0.048152483999729156,Cs,0.001326016616076231,0.01776951737701893,0.001015062560327351
1422149905611739136,"Andalucía lo tenía todo para ser una región puntera de Europa. Sólo necesitaba un Gobierno a la altura. Con el nuevo Gobierno de Cs y PP esta tierra es referente en creación de empresas, autónomos y oportunidades. ¡Enhorabuena, andaluces! 👏 💚🤍💚
https://t.co/SkQbLDwVp0",ines-arrimadas-garcia,ciudadanos,Cs,0.00568282138556242,0.0018318563234061003,VOX,0.007852096110582352,PSOE,0.0021414561197161674,0.005231488961726427,0.002086128108203411
1422205535743578121,"El Gobierno de Andalucía con @JuanMarin_Cs @RocioRuizDom @rogeliovelascop @javierimbroda y Rocio Blanco, en Consejerías naranjas, es imparable. https://t.co/QExvuO0MWt",guillermo-diaz-gomez,ciudadanos,Cs,0.0154111972078681,0.0012302253162488341,Partido popular,0.053564880043268204,Ciudadanos,0.0013688880717381835,0.01889682188630104,0.0011986882891505957
1422264457565282310,"En Cs fuimos los primeros en denunciar el escándalo Plus Ultra, tanto en España como en la UE. Y no pararemos hasta saber la verdad, porque de ello depende que los fondos europeos no se malgasten como con esta empresa: a dedo y sin cumplir los requisitos.
https://t.co/OUzwnYC2yt",ines-arrimadas-garcia,ciudadanos,Cs,0.5623814463615417,0.0011791179422289133,VOX,0.7299006581306458,VOX,0.0016711781499907374,0.47607752680778503,0.0009843651205301285
1422584459073921034,"Le deseo una pronta recuperación al funcionario de prisiones agredido en Aranjuez, y traslado mi apoyo al cuerpo de servidores públicos que trabajan en duras condiciones. Cs seguirá reclamando que se les reconozca como agentes de la autoridad #SOSPrisiones
https://t.co/PzMNz77G5u",,,Cs,0.004659241531044245,0.0021906686015427113,VOX,0.005231022369116545,Partido popular,0.002477005822584033,0.0045753950253129005,0.0022335387766361237
1422884294410874881,"En su desesperación por contentar a ERC, Sánchez no va a dejar en pie un solo principio de igualdad. 

No respeta ni el éxito del MIR, ni la calidad de la Sanidad de los españoles. 

No solo lo dice Cs, lo denuncian los médicos #SalvemosElMIR👇https://t.co/Ls6j21bOvB",ines-arrimadas-garcia,ciudadanos,Cs,0.967040479183197,0.006899968255311251,PODEMOS,0.9783303141593933,PODEMOS,0.010567457415163517,0.9692293405532837,0.007656496949493885
1423222661669429251,"Queda mucho por hacer en materia de igualdad entre hombres y mujeres, también en la #carreradiplomática.

El compromiso de @CiudadanosCs es claro: queremos eliminar barreras para que las diplomáticas españolas puedan acceder a los puestos que deseen. https://t.co/25j0kkdga7",,,Cs,0.0046444241888821125,0.002176519948989153,Unidas Podemos,0.008745570667088032,Cs,0.002176519948989153,0.004825966898351908,0.0021284474059939384
1423317296265695242,"Como liberal, no puedo sino sumarme a este manifiesto impulsado, entre otros, por Mario Vargas Llosa o Mark Lilla en @Letras_Libres.

Un texto para redoblar el apoyo que venimos ofreciendo desde hace tiempo en @CiudadanosCs a los demócratas nicaragüenses. https://t.co/KFjVFKi5Lh",,,Cs,0.005341935902833939,0.0017387740081176162,PODEMOS,0.007475424557924271,PSOE,0.001862459466792643,0.005705901421606541,0.0016244736034423113
1424381151645507589,"El Gobierno sigue con sus injerencias sobre la Justicia. Ahora, Llop presiona al Supremo para que no anule los indultos. Estas presiones políticas tienen que acabar, con los indultos y con el CGPJ. Nosotros iremos hasta el final, y gracias a Cs habrá un pronunciamiento de fondo. https://t.co/GwKOd7uutX",,,Cs,0.48949700593948364,0.0012203122023493052,VOX,0.7251434922218323,Partido popular,0.0018765426939353347,0.5095977783203125,0.0011996891116723418
1425781267962998787,"La nueva Ley de Memoria Histórica tiene mucha propaganda y poca honestidad. Desde Cs pedimos al Gobierno que la ley permita condenar los homenajes a etarras e impida actos de humillación a las víctimas del terrorismo.

Mi entrevista hoy en @eldiarioes 👇🏻
https://t.co/qZAfaGa9dt",,,Cs,0.008433838374912739,0.0012500908924266696,VOX,0.012598934583365917,Partido popular,0.0013333756942301989,0.007540754042565823,0.0013406529324129224
1426125875590967300,"Cs registra en el Congreso una iniciativa para hacer del Bono Social Eléctrico una verdadera ayuda contra la subida del precio de la luz:

✅Más familias protegidas
✅Más descuentos
✅Menos requisitos y trámites
✅IVA reducido hasta llegar al nivel de empleo previo a la pandemia https://t.co/OFnD54f06s",,,Cs,0.0055844830349087715,0.0017688577063381672,PSOE,0.006549234502017498,Ciudadanos,0.0019238886889070272,0.007141544949263334,0.0014645387418568134
1426159142700470273,"La situación en Afganistán es de extrema gravedad no sólo para la estabilidad internacional, sino especialmente para la población afgana.

Desde @CiudadanosCs pedimos al Gobierno gestiones para no abandonar a quienes han luchado por la paz y la democracia. https://t.co/9HRoXF2k26",,,Cs,0.007282338570803404,0.001607861602678895,PODEMOS,0.009176596999168396,Cs,0.001607861602678895,0.008145577274262905,0.0014915242791175842
1426198558231904256,"La factura de la luz alcanza nuevo máximo histórico, y desde @CiudadanosCs seguimos trabajando para paliar su efecto sobre familias y empresas.

Proponemos reforzar el Bono Social Eléctrico y ampliarlo a más familias para que nadie deba mirarse el bolsillo en esta ola de calor. https://t.co/95Wi2kpIOU",,,Cs,0.008637560531497002,0.0016370844095945358,Unidas Podemos,0.011407535523176193,Ciudadanos,0.0017421245574951172,0.008836873807013035,0.0015722084790468216
1426231050196463620,"La Junta de Andalucía es un ejemplo de cómo ayudar a las familias con el precio de la luz. 141.000 personas han recibido ya el Bono Social Térmico complementario al Eléctrico, que la Consejería de Políticas Sociales de Cs puso en marcha hace más de un mes.
https://t.co/nGnuCzEgx9",,,Cs,0.004454968962818384,0.0022699146065860987,Unidas Podemos,0.00531333452090621,Ciudadanos,0.002286264905706048,0.005915062967687845,0.0016150184674188495
1427025515286827011,"Siguiendo con preocupación los incendios que asolan nuestro país, especialmente en la provincia de Ávila. Desde Cs enviamos todo nuestro apoyo a los afectados y a los servidores públicos que trabajan sin descanso contra el fuego en circunstancias extremas.
https://t.co/tUGw8G2oR4",ines-arrimadas-garcia,ciudadanos,Cs,0.004824540112167597,0.0020034429617226124,Unidas Podemos,0.0063552395440638065,Ciudadanos,0.002096367534250021,0.004868926014751196,0.002096645999699831
1427198003249569792,"En @CiudadanosCs seguimos trabajando para proponer medidas que aborden la situación en Afganistán. 

1️⃣ Pedimos la comparecencia de @jmalbares.
2️⃣ Proponemos acelerar la evacuación de españoles y colaboradores afganos.
3️⃣ Solicitamos un corredor humanitario para mujeres y niños. https://t.co/3bCiya58ng",,,Cs,0.006247378420084715,0.0018277768976986408,PODEMOS,0.008710544556379318,Cs,0.0018277768976986408,0.00637690257281065,0.0017604394815862179
1427983042807799812,Los bandazos e incoherencias de PP  y VOX con la energía: de preguntar por las presas caducadas a ridiculizar la empresa pública.  https://t.co/J1umxICs8g,juan-antonio-lopez-de-uralde-garmendia,podemos,Cs,0.9547560811042786,0.007001941092312336,Unidas Podemos,0.984889030456543,Unidas Podemos,0.024549489840865135,0.9704179167747498,0.010992815718054771
1428088776031543298,Sánchez sigue sin dar la cara ante la situación en Afganistán. Cs preguntó hace dos semanas al Gobierno por su plan de evacuación en Kabul. Lo descartaron y hoy España va con gran retraso respecto a otros países. Una ausencia de liderazgo internacional nefasta para nuestro país👇🏻 https://t.co/oYaz9kD9H0,,,Cs,0.7874115705490112,0.0017780943308025599,VOX,0.8301312327384949,VOX,0.002025051973760128,0.6503202319145203,0.001335049164481461
1428308058636263426,"Celebramos que el #IFNavalacruz haya sido estabilizado y agradecemos la labor de todos los servicios de emergencias.

Ahora el Gobierno debe empezar a compensar los daños económicos. En Cs pedimos en Congreso declarar zona catastrófica el área afectada gravemente por las llamas👇🏻 https://t.co/TOeOsYUvW2",,,Cs,0.009958175010979176,0.0013509460259228945,VOX,0.014378123916685581,PP,0.0014133643126115203,0.010800470598042011,0.0013251720229163766
1428669009885532162,"Un día más, el #MarMenor amanece con una catástrofe ambiental, mientras el gobierno de la Región de Murcia se niega a cumplir la ley que impulsó @CiudadanosCs.

Seguimos proponiendo medidas urgentes para proteger nuestro patrimonio natural.
https://t.co/p1VnypKkTY",,,Cs,0.007597420364618301,0.001529030967503786,Unidas Podemos,0.015374217182397842,Ciudadanos,0.001569254556670785,0.007796938996762037,0.0014772274298593402
1429734686926979080,La respuesta a la crisis afgana refuerza el papel internacional de España https://t.co/eF4Z1uACs8,arnau-ramirez-carner,psoe,Cs,0.004573221784085035,0.00223889434710145,Unidas Podemos,0.007747640833258629,PSOE,0.002316187135875225,0.004888204392045736,0.0019948026165366173
1429783877283991560,"Es urgente actuar con coordinación y seriedad ante la terrible situación del Mar Menor. 
Por eso Cs propone una Comisión de Investigación en el Senado para escuchar a los expertos, buscar soluciones a largo plazo y aclarar si se está aplicando la ley de protección.

#SOSMarMenor https://t.co/Zh8wYi6voW",,,Cs,0.004358295351266861,0.0022030449472367764,VOX,0.004517902620136738,Ciudadanos,0.0023350627161562443,0.004235764965415001,0.002259730128571391
1430126102685573120,"Una vez más, PSOE y PP siguen culpándose mutuamente sin dar soluciones para la catástrofe ambiental en el Mar Menor. Cs logró que ambos se sentaran a la mesa para aprobar la Ley del Mar Menor, y hoy somos el único partido ofreciendo soluciones de consenso. Necesitamos actuar ya👇🏻 https://t.co/q76ynLp38o",ines-arrimadas-garcia,ciudadanos,Cs,0.03636164218187332,0.0007233032374642789,Partido popular,0.058120500296354294,PODEMOS,0.0007404392817988992,0.04871270805597305,0.0006932531832717359
1430491355889995776,"La Justicia ha sido clara: el confinamiento era necesario, pero el Gobierno se equivocó en las formas.

Cs planteó una reforma legal para proteger los derechos y libertades de los ciudadanos, pero no escucharon. 

Ahora Sánchez debe dar la cara👇
https://t.co/L0b6VuWhrx",maria-munoz-vidal,ciudadanos,Cs,0.43887069821357727,0.0010751457884907722,Partido popular,0.6586999297142029,Partido popular,0.0014706614892929792,0.5974100232124329,0.0011980821145698428
1430496868740571145,"Señores del PP, ser liberal significa defender la ley por encima de todo, también por encima de intereses partidistas. 

En Cs lo tenemos claro, el ministro Marlaska debe dimitir por las presuntas irregularidades en la devolución de menores en Ceuta. https://t.co/DUwdSi61u0",maria-munoz-vidal,ciudadanos,Cs,0.023558076471090317,0.0009346473379991949,VOX,0.05235573649406433,PP,0.0011193100363016129,0.015399603173136711,0.0010820269817486405
1430566371562336264,"Mañana el precio de la luz volverá a batir récords, pero el Gobierno sigue sin aportar soluciones para aliviar el bolsillo de las familias españolas. 

Desde Cs pedimos dejar a un lado las ocurrencias e impulsar con carácter urgente un Pacto Nacional por la Energía. https://t.co/2fAdvPMpYf",,,Cs,0.011907770298421383,0.0011248361552134156,Unidas Podemos,0.015451181679964066,Ciudadanos,0.001155206118710339,0.011292981915175915,0.0011691320687532425
1430889180083757056,"Presentamos un plan de choque para salvar el #SOSMarMenor:

1️⃣Asegurar que se cumple la Ley de Protección impulsada por Cs

2️⃣Controlar vertidos 

3️⃣Ayudas para una agricultura más sostenible

4️⃣Comisión de Investigación que depure responsabilidades y dé soluciones

@BalEdmundo👇🏻 https://t.co/NopLAIdP0g",ines-arrimadas-garcia,ciudadanos,Cs,0.004609786439687014,0.002094070427119732,Partido popular,0.005614113062620163,Cs,0.002094070427119732,0.005269468296319246,0.001772301271557808
1430895703367110670,"Hoy he estado en Murcia ante la crítica situación del #SOSMarMenor, un patrimonio natural que debemos salvar. Ya basta de que PSOE-PP nos hagan perder un tiempo que no tenemos: déjense de excusas partidistas, colaboren y cumplan la ley de protección de la laguna que Cs impulsó👇🏻 https://t.co/jGfS7q48xi",,,Cs,0.027317732572555542,0.0007969090947881341,Vox,0.04262229800224304,Cs,0.0007969090947881341,0.018134962767362595,0.0008778885239735246
1431533587782934531,"Allí donde Cs gobierna, hay bajadas de impuestos y ayudas a las familias. El sello naranja de la buena gestión. Enhorabuena a la alcaldesa @MasiasEva, a su equipo y a los vecinos de Ciudad Real 👏👇

‘Ciudad Real reducirá el IBI y habrá más bonificaciones’ https://t.co/OYO5vVKxDT",ines-arrimadas-garcia,ciudadanos,Cs,0.0050272648222744465,0.0017313631251454353,Unidas Podemos,0.006554253399372101,PODEMOS,0.0025108722038567066,0.003849321510642767,0.0024350828025490046
1432398993208840206,"Cs impulsó una Ley de Protección del Mar Menor, pero desde que no estamos en el gobierno de la Región de Murcia no se cumple.
Hoy he pedido a la ministra Ribera que el Gobierno tome medidas y apueste por el consenso para evitar que el Mar Menor se convierta en el Mar Muerto. https://t.co/3x1vomNdtm",,,Cs,0.00670408271253109,0.0016108128475025296,VOX,0.009161771275103092,PSOE,0.0020145042799413204,0.005728250369429588,0.0018103935290127993
1432452150169415686,"Cs lleva al Congreso la creación de unidades 'long Covid'

Seguimos por la vía de las propuestas.  https://t.co/wR6pLO0C2L",guillermo-diaz-gomez,ciudadanos,Cs,0.0070002577267587185,0.001619995920918882,Vox,0.011588641442358494,PODEMOS,0.0020686511415988207,0.008857195265591145,0.001369641744531691
1432667212352036874,"Las palabras de Irene Montero comparando el horror que sufren las #MujeresAfganas con la situación en España son una barbaridad que frivoliza los atropellos del régimen talibán y mancha el nombre de nuestro país.

Junto a compañeras de Cs, exigimos a la ministra que se retracte👇🏻 https://t.co/y3VISX0ULp",ines-arrimadas-garcia,ciudadanos,Cs,0.786381721496582,0.001678572385571897,VOX,0.9237474799156189,VOX,0.0034286275040358305,0.6694739460945129,0.001305060344748199
1432674026195988480,"Aprovechar la pesadilla que sufren las #MujeresAfganas para frivolizar y buscar el titular de turno es algo indigno e impropio de una ministra de Igualdad.

Por eso, desde Cs solicitamos a Irene Montero que se retracte de sus palabras. https://t.co/Wkt6nIcZoT",maria-munoz-vidal,ciudadanos,Cs,0.5990175604820251,0.0020632620435208082,VOX,0.8123646974563599,VOX,0.0033371306490153074,0.5140300989151001,0.0019258023239672184
1433353281577918466,"""Los jueces no pueden elegir a los jueces"".
Qué barbaridad, ministro. Esa fórmula no sólo la pide Cs, la recoge la Constitución, la exige Europa y la piden asociaciones independientes de jueces. Lo que Uds. quieren es seguir repartiéndose los jueces con el PP y los nacionalistas. https://t.co/VJ7NnCAedB",,,Cs,0.9093944430351257,0.0035001805517822504,VOX,0.9372572302818298,VOX,0.004557541571557522,0.8917890787124634,0.003145970404148102
1433710277908910123,"Con mayoría absoluta, ""el PP tuvo la ocasión de abordar de una manera definitiva la despolitización de la justicia y no lo hizo"". PSOE y PP llevan décadas mercadeando con el CGPJ. Como @abc_es, Cs ha defendido siempre -no sólo en campaña-, que los jueces elijan a los jueces👇🏻 https://t.co/ohDb3XNYXv",,,Cs,0.9348616600036621,0.004448777064681053,VOX,0.9648888111114502,VOX,0.007767548318952322,0.9370110034942627,0.005003101192414761
1433726553792331777,Esta noche radicales separatistas han atacado por quinta vez nuestra sede en Cornellà. El nacionalismo lleva años señalando a quienes pensamos distinto para que discrepar salga muy caro en Cataluña. Todo mi apoyo a los compañeros de @CiutadansCs. Los intolerantes #NoNosCallarán💪🏻 https://t.co/atgCbfylUI,ines-arrimadas-garcia,ciudadanos,Cs,0.9962984919548035,0.8720482587814331,Partido popular,0.9964742064476013,VOX,0.8765138983726501,0.9962382316589355,0.8452606201171875
1433727320150454286,Esta noche radicales separatistas han atacado por quinta vez nuestra sede en Cornellà. El nacionalismo lleva años señalando a quienes pensamos distinto para que discrepar salga muy caro en Cataluña. Todo mi apoyo a los compañeros de @CiutadansCs. Los intolerantes #NoNosCallarán💪🏻 https://t.co/oDomxOBWqA,ines-arrimadas-garcia,ciudadanos,Cs,0.9962796568870544,0.8902288675308228,Partido popular,0.9964861869812012,VOX,0.8917450308799744,0.9962098598480225,0.8621488213539124
1433771976296914949,"Hemos presentado iniciativas en el @Congreso_Es de toda índole para prevenir el suicidio y para atender a los supervivientes. 

Por supuesto que aquí estaremos, contra el tabú, por la vida. @CiudadanosCs #stopsuicidios #StopSuicide https://t.co/jnyKEMxPfB",guillermo-diaz-gomez,ciudadanos,Cs,0.006272817961871624,0.0015036165714263916,Unidas Podemos,0.011928603984415531,PSOE,0.0016205761348828673,0.0069846357218921185,0.0013848156668245792
1434783448686866434,"Hace una semana lo avisamos, y desde @CiudadanosCs pedimos liderar el apoyo internacional a quienes se resistían al régimen talibán en Panjshir.

Hoy, por desgracia, los extremistas consiguen algo que jamás pudieron hacer y ya controlan todo el país. https://t.co/ApfOJRSMPk",,,Cs,0.32201796770095825,0.0010753351962193847,Unidas Podemos,0.6411789059638977,Unidas Podemos,0.0014909881865605712,0.33638083934783936,0.0010411745170131326
1434900138477113351,"Ni bloqueo, ni pasteleo. PSOE-PP llevan 36 años mercadeando con el CGPJ. Cs propone una vía para que este sea el último inicio de año judicial con un sistema de reparto a dedo: en unas semanas se puede reformar la ley, cumplir con Europa y la Constitución👇https://t.co/00rC3PBldM",,,Cs,0.9970393180847168,0.9710320234298706,Unidas Podemos,0.9972133040428162,PSOE,0.9820870161056519,0.9971218705177307,0.9625846743583679
1435250722371686404,"Desde @CiudadanosCs venimos advirtiéndolo: el respeto a la independencia judicial y a las libertades individuales es clave para acceder a fondos europeos.

No podemos jugárnosla mandando una señal errónea a la Unión Europea por el control del CGPJ. 

https://t.co/vQyI4HLqde",maria-munoz-vidal,ciudadanos,Cs,0.007700549904257059,0.0014479318633675575,Unidas Podemos,0.011574383825063705,PSOE,0.0015554152196273208,0.008054403588175774,0.0014141835272312164
1436317267244036159,"El precio de la luz bate hoy otro récord y por primera vez supera los 150€ el megavatio/hora. Un drama que está asfixiando a familias, autónomos y pymes ante la inacción del Gobierno. Debe rectificar y tomar medidas a corto, medio y largo plazo como las que proponemos desde Cs👇 https://t.co/ZH481eRCGi",ines-arrimadas-garcia,ciudadanos,Cs,0.04418690875172615,0.0006848038174211979,PSOE,0.04683377221226692,Ciudadanos,0.0007480040658265352,0.03636913746595383,0.0007189305033534765
1436729893128130567,"La comisión de investigación del caso FAFFE, impulsada por @Cs_Andalucia, está destapando más escándalos del PSOE andaluz. Una época de enchufismo y corrupción que no debe volver. No os perdáis este vídeo sobre la contratación de la mujer de Juan Espadas👇
https://t.co/s2SvR6tUGa",ines-arrimadas-garcia,ciudadanos,Cs,0.029064487665891647,0.0008240354945883155,Partido popular,0.04809332266449928,PSOE,0.000899217207916081,0.02510245144367218,0.0008659220184199512
1436765780956360707,"Hoy hemos estado en Madrid en la manifestación de #StopSuicidios. 

Hay que conseguir que toda la sociedad española conozca este gran drama oculto. 

@CiudadanosCs vamos a seguir proponiendo medidas para mejorar la Salud Mental en España. No es la hermana pequeña, es salud. https://t.co/ATV8Pdu162",guillermo-diaz-gomez,ciudadanos,Cs,0.009205593727529049,0.001221087179146707,PODEMOS,0.01946006529033184,PSOE,0.0013494722079485655,0.011363796889781952,0.0010734274983406067
1437432968562323460,La dimisión de la vicerrectora de la UPC que llamó a colapsar el aeropuerto en la Diada es una victoria del constitucionalismo. Cs seguirá denunciando estas actitudes hasta que el separatismo deje de creerse impune en las instituciones y tengamos una universidad libre y neutral💪🏻 https://t.co/HMpX311HWF,ines-arrimadas-garcia,ciudadanos,Cs,0.06633362174034119,0.0006288622389547527,Vox,0.20918723940849304,VOX,0.0007385495700873435,0.08008358627557755,0.000612891570199281
1438090980067004420,"Gran trabajo trabajo de nuestra Consejera Rocio Blanco @Cs_Andalucia @EmpleoJunta 
 👇🏼👇🏼👇🏼

https://t.co/6UKZSDxYtR",,,Cs,0.003699511755257845,0.0027150462847203016,PODEMOS,0.004192754626274109,Ciudadanos,0.0027626336086541414,0.003955450374633074,0.002430038759484887
1438131901684985861,"Siempre he pensado que la ELA es una de las enfermedades más crueles que existen. Cs logró instar al Gobierno a actuar y mejorar las condiciones de los pacientes que la sufren. Tras meses sin cambios, presentamos una ley para acelerar la toma de medidas👇 https://t.co/ueRPDkXAZk",ines-arrimadas-garcia,ciudadanos,Cs,0.006498777773231268,0.0017358860932290554,Vox,0.008316965773701668,Ciudadanos,0.002032345626503229,0.007982706651091576,0.0014711573021486402
1438183659195052033,"Hoy he asistido a la movilización de agricultores de la Costa Tropical para mostrarles el apoyo de Cs. Pedimos a Sánchez que actúe: la canalización de Rules no sólo es buena para la agricultura, también lo sería para el turismo y el consumo humano de agua.
https://t.co/OAhGsjBZId",,,Cs,0.006884855683892965,0.001463390071876347,VOX,0.0074179694056510925,Ciudadanos,0.0020135410595685244,0.005136867053806782,0.0018804381834343076
