twitter_id,original_text,slug,party_slug,party_original,toxic_original,very_toxic_original,most_toxic_party,most_toxic_party_toxicity,most_verytoxic_party,most_verytoxic_party_toxicity,PARTIDO_toxic,PARTIDO_verytoxic
1382698797365669896,"En Madrid hay 1.700 familias que siguen esperando asignación en centros de atención primaria a menores de 6 años. Cs logró priorizar el asunto en el acuerdo de gobierno.

Tras el #4M aumentaremos las plazas hasta reducir por completo las listas de espera👇🏻
https://t.co/81zl4GVwMp",,,Cs,0.008024650625884533,0.0014731690753251314,PP,0.008822551928460598,Ciudadanos,0.0019286904716864228,0.009347104467451572,0.0014380264328792691
1382706979949395974,"En Madrid hay 1.700 familias que siguen pendientes de asignación en centros de atención temprana a menores de 6 años. Cs llevó reducir las listas de espera al acuerdo de gobierno y tras el #4M aumentaremos las plazas hasta eliminar la espera por completo👇🏻
https://t.co/xx51K2Ywfd",,,Cs,0.007638301234692335,0.0015442322473973036,VOX,0.020438391715288162,PODEMOS,0.001813182607293129,0.01092465128749609,0.0013191577745601535
1382733518279704584,"Es inexplicable que en pleno siglo XXI las empresas tengan que pasar dos, tres y hasta 17 trámites para operar dentro de su país. Con Cs en el gobierno, impulsaremos la ley de unidad de mercado para abrir Madrid a las pymes de toda España. Basta de trabas👇🏻https://t.co/1BOMWZiap0",,,Cs,0.009923784993588924,0.001304773148149252,Unidas Podemos,0.013388527557253838,Ciudadanos,0.001532678259536624,0.007248321082442999,0.0016118031926453114
1382765624385011719,No puede ser que el mercado español esté más fragmentado que el europeo. Es de sentido común: si una empresa cumple requisitos en cualquier comunidad autónoma debe poder operar en toda España sin pasar 17 trámites. Cs lo hará posible en Madrid desde el gobierno. @BalEdmundo👇 https://t.co/5MJw5oA6To,ines-arrimadas-garcia,ciudadanos,Cs,0.01169681828469038,0.001066935365088284,PSOE,0.05281654745340347,Ciudadanos,0.0013569355942308903,0.011206453666090965,0.0010225834557786584
1382813207476195330,"Noelia Losada: «No entiendo el silencio de los patronos ante una decisión que perjudica a Málaga» | Diario Sur

En ⁦@CiudadanosCs⁩ lo tenemos claro. Grande ⁦@NoeliaLosadaCs⁩  https://t.co/InQcXsYS3b",guillermo-diaz-gomez,ciudadanos,Cs,0.005870078224688768,0.0016839522868394852,PODEMOS,0.01308149192482233,Partido popular,0.001778729259967804,0.006628057453781366,0.001523700775578618
1382997291481632779,"En el palco del ⁦@unicajaCB⁩ solo estuvo ⁦@NoeliaLosadaCs⁩ como representante institucional. 

Pero no estaba sola, tiene detrás a miles de malagueños y a ⁦@CsMalaga⁩. 

Es hora de dar la cara.  https://t.co/sB9xc0h9Vo",guillermo-diaz-gomez,ciudadanos,Cs,0.013541865162551403,0.001093292492441833,PODEMOS,0.03201424330472946,Ciudadanos,0.0011826453264802694,0.019179943948984146,0.0010044722585007548
1383009537389629442,Cs Málaga culmina su proceso de renovación de las agrupaciones locales https://t.co/Db0gsrgNY5,guillermo-diaz-gomez,ciudadanos,Cs,0.005905173718929291,0.0019694354850798845,Cs,0.005905173718929291,Ciudadanos,0.002242100890725851,0.005309323780238628,0.0021975187119096518
1383073898481192962,"El PP debe aclarar si quiere cambiar a Cs por Vox en el gobierno de Madrid. Gabilondo ya aclara con su anuncio de vicepresidencia que sigue el camino de Sánchez para devolver a Iglesias el coche oficial. Los madrileños elegirán moderación y centro el #4M👇🏻
https://t.co/GqnszR37ZA",,,Cs,0.4115501940250397,0.0009314797352999449,PODEMOS,0.7014433145523071,PODEMOS,0.0014141316059976816,0.4716281294822693,0.001032413449138403
1383183484529807363,"La gestación subrogada , que tanto ha defendido @CiudadanosCs es explotación de mujeres pobres y compraventa de bebés

¿Tengo que ponerte la foto de un cachorrito para que lo entiendas? https://t.co/6fFurD837B",,,Cs,0.9955877065658569,0.9922031164169312,Partido popular,0.9965452551841736,Vox,0.9929065704345703,0.9954296350479126,0.992378830909729
1383403471253086218,"🎭 Madrid es pura cultura. La pandemia ha castigado al sector y en Cs queremos seguirles ayudando  como hemos hecho en el Gobierno:

Impulsaremos un bono de 100 €/año para que los jóvenes puedan disfrutar de cines, teatros, museos, etc. #CsEsCultura
https://t.co/6oWbTZtCut",,,Cs,0.0062829917296767235,0.001773359370417893,PP,0.008095373399555683,Ciudadanos,0.0018740133382380009,0.007011104840785265,0.0016123472014442086
1383461239800537099,"En unos minutos nos vemos en la Plaza de Ópera con @begonavillacis, @InesArrimadas y los compañeros de @Cs_Madrid para dar inicio a una campaña emocionante en la que vamos a llevar el centro, la concordia y la sensatez a cada rincón de nuestra tierra🧡💪🏻

https://t.co/AaMbrS3aCc https://t.co/dn5KJApG9v",,,Cs,0.004159373231232166,0.002612210577353835,PODEMOS,0.005194932222366333,Cs,0.002612210577353835,0.004262371454387903,0.002474012551829219
1383709637086629899,"Madrid lleva dos años avanzando: con impuestos bajos, con ayudas a familias, autónomos y pymes y sin un escándalo de corrupción. Y es gracias a la gestión de Cs. No hay que tocar lo que funciona. No hay que retroceder, sino seguir avanzando.

En @el_pais👇
https://t.co/zmdI0dnx0A",ines-arrimadas-garcia,ciudadanos,Cs,0.028413742780685425,0.0007806739886291325,Vox,0.10342896729707718,Ciudadanos,0.0009532709955237806,0.013565435074269772,0.0009265185799449682
1383785162463334400,"Porque @BalEdmundo será el presidente del Madrid de todos.

Porque Cs es la única opción que garantiza que no gobiernen los extremos.

Porque hay que recuperar la concordia y seguir con la política social y económica como hacíamos hasta ahora.

Por todo esto y más #eligecentro https://t.co/otSD7CrM74",maria-munoz-vidal,ciudadanos,Cs,0.029455754905939102,0.0007340084994211793,VOX,0.19182951748371124,Partido popular,0.0008417238714173436,0.012972205877304077,0.0009625485981814563
1383790303149051909,"El #EquipoCs ha demostrado una y otra vez que sabe gestionar. El 4M no te la juegues con otros partidos a los que no les gusta trabajar y que quieren probar experimentos con los extremos, vota seguro con @BalEdmundo  y @CiudadanosCs.

Gran acto hoy en El Molar💪🍊 https://t.co/BcVztH29Pg",jose-maria-espejo-saavedra-conesa,ciudadanos,Cs,0.5714750289916992,0.00136664230376482,VOX,0.667625367641449,VOX,0.0016758042620494962,0.8134098649024963,0.002434161026030779
1383793357877485569,"El #EquipoCs es la mejor opción para Madrid porque sabemos gestionar y tenemos ganas de trabajar. Lo hemos demostrado en los más de 30 ayuntamientos que gobernamos en Madrid.

Gracias a todos los que nos habéis acompañado en El Molar. La ilusión del centro sigue creciendo. 🍊💪 https://t.co/zOUMywqDcf",,,Cs,0.004420117475092411,0.0023388571571558714,Unidas Podemos,0.004865170922130346,PSOE,0.0024713545572012663,0.004846225958317518,0.0021260452922433615
1383795373299290123,"Ciudadanos cuenta con todo un ejército de buenos gestores en Madrid. El #EquipoCs gobierna en más de 30 municipios, incluida la capital, y es el motor del milagro económico y social de la Comunidad.

El 4 de mayo hay que apostar por esa experiencia, no hacer experimentos👇 https://t.co/lO74V3zZlR",ines-arrimadas-garcia,ciudadanos,Cs,0.009000370278954506,0.0011679178569465876,PP,0.018851593136787415,PSOE,0.0014848432037979364,0.009206581860780716,0.001117852283641696
1383840893329805320,"Para darle la vuelta a 26 años de privatizaciones y corrupción en Madrid hay que plantar cara a la derecha y la ultraderecha con firmeza y con un proyecto claro de reconstrucción de los servicios públicos, la justicia fiscal y la igualdad. Eso es lo que aporta Unidas Podemos. https://t.co/s9d6CsWru7",pablo-iglesias-turrion,,Cs,0.26192569732666016,0.0008736885502003133,PODEMOS,0.29307320713996887,PP,0.0009065631311386824,0.2485107034444809,0.0008635381818749011
1384069557891989508,"La fórmula que permite tener políticas sociales ambiciosas: estímulo económico y gestión eficiente.

El trabajo de Cs al frente de la economía en el gobierno autonómico ha permitido a los madrileños pagar menos impuestos sin que la recaudación se hunda👇
https://t.co/sAYByapf5P",,,Cs,0.007078951690346003,0.0013928780099377036,PODEMOS,0.00818423181772232,Ciudadanos,0.0016582608222961426,0.0060220262967050076,0.0016265705926343799
1384136270763335692,"La alternativa a la bochornosa ley Celaá que se carga la libertad de elección de los padres no puede ser impedir que los hijos se eduquen en valores democráticos del siglo XXI. 

El plan de Cs para la Educación:
✅Refuerzo del personal docente
✅Sacar la ideología de la aulas https://t.co/FEYdtzBBi4",,,Cs,0.8742414116859436,0.0026907967403531075,PSOE,0.9284283518791199,PSOE,0.004927448462694883,0.8989071846008301,0.0031443035695701838
1384389636135563265,"En 2017 @CiudadanosCs llevó al Congreso por primera vez la propuesta de reforma del Código Civil para que los animales dejen de ser considerados “cosas”.  Con la moción de censura decayó. 

Hoy vuelve a traerse al Congreso. #AnimalesNOsonCosas. Bien hecho

https://t.co/D2AEHpAO46",guillermo-diaz-gomez,ciudadanos,Cs,0.012269397266209126,0.0010902403155341744,Unidas Podemos,0.04684426635503769,PSOE,0.0011523360153660178,0.014339955523610115,0.0010269514750689268
1384796535070801921,"Madrid prueba que Cs gobierna con cabeza en la economía y corazón en política social. Crecimiento económico y estado del bienestar. El #4M solo Cs garantiza que la cordura no se cambia por el disparate ni la concordia por la división👇🏻

En @elconfidencial. https://t.co/3ud7WfFO9U",,,Cs,0.6151572465896606,0.001321251387707889,Vox,0.8918769359588623,Vox,0.0033547142520546913,0.4368131160736084,0.0010657628299668431
1384861935859023875,"Pido a Pedro Sánchez y Pablo Casado que renuncien a repartirse el CGPJ, esta vez y para siempre. Debemos impulsar una mesa a tres PSOE-Cs-PP para aprobar una reforma que garantice que los jueces eligen a los jueces. 

Cumplamos con la Constitución, la UE y el sentido común👇 https://t.co/yY6SpTRW5R",ines-arrimadas-garcia,ciudadanos,Cs,0.04237290844321251,0.0007514993194490671,PODEMOS,0.1629769206047058,Cs,0.0007514993194490671,0.05418114364147186,0.0007520580547861755
1384864745765888003,"He exigido en el Congreso el fin de los ataques de la extrema derecha. El último, un cóctel molotov contra nuestra sede en Cartagena. Gracias a todas las fuerzas que nos han dado su apoyo. https://t.co/D3nCspBVX0",jaume-asens-llodra,catalunya-en-comu,Cs,0.47010931372642517,0.001777388621121645,PP,0.5051652193069458,PP,0.0018942884635180235,0.45540156960487366,0.0016559447394683957
1384989384924147714,"¡Muchas gracias a todos los que habéis seguido el #DebateTelemadrid! Para mí ha sido un placer explicar nuestras propuestas para seguir haciendo de Madrid una maravillosa tierra de oportunidades. Este 4M no hagamos experimentos, mantengamos la sensatez de Cs en el Gobierno 💪🍊 https://t.co/UW73KMZucW",,,Cs,0.006771652493625879,0.001450559590011835,VOX,0.02931847982108593,Partido popular,0.0018492944072932005,0.004776461981236935,0.0020354765001684427
1385186728336572419,"En unos minutos estaré en @elmundoes con @JorgeBustos1 y @JqManso, respondiendo también a preguntas de los lectores. Explicaré por qué Cs es la mejor opción para que la unión y la moderación triunfen en Madrid ante la división y la radicalidad. ¡Os espero! https://t.co/9J7J65FQlA https://t.co/2FKUmtIje0",,,Cs,0.007179794367402792,0.001225820160470903,Unidas Podemos,0.009639596566557884,Partido popular,0.001326358993537724,0.006580977700650692,0.0013207676820456982
1385340982888222721,"Hemos presentado en la Comisión de transición ecológica  una iniciativa para acelerar la implementación de estrategias de hidrógeno verde en nuestro país y ha salido aprobada. 

Así trabaja Cs: a problemas reales de los españoles, soluciones. https://t.co/uwZSqSxexe",,,Cs,0.005031800363212824,0.0019230860052630305,Partido popular,0.008223115466535091,PODEMOS,0.002247896511107683,0.0050343358889222145,0.0019776555709540844
1385355604416401417,"Mi firme condena a estas amenazas de muerte a Grande-Marlaska, María Gámez y Pablo Iglesias. En Cs sabemos bien lo que es sufrir ataques así y pedimos la unidad de los demócratas para rechazarlos de plano. Vengan de donde vengan, los sufra quien los sufra. https://t.co/UYM1I9axGE",ines-arrimadas-garcia,ciudadanos,Cs,0.18399393558502197,0.0007996190688572824,PSOE,0.3753221035003662,VOX,0.0010558621725067496,0.3070102334022522,0.0009275820339098573
1385533756493213700,"En @CiudadanosCs hemos condenado las amenazas contra @PabloIglesias hemos condenado los ataques a @vox_es. 

@PODEMOS alentó en el Orgullo el ataque a @CiudadanosCs y Vox dijo que nos estaba bien empleado. 

Y entre ellos crispan de forma muy calculada. 

España no merece esto.",guillermo-diaz-gomez,ciudadanos,Cs,0.9962737560272217,0.3801298439502716,Vox,0.9966995120048523,Vox,0.5497573018074036,0.9961744546890259,0.3471510410308838
1385548108130623490,"Lo sucedido en el #DebateSER es un ejemplo terrible para la sociedad. No quiero esta España para nuestros hijos. Los extremos se necesitan y se retroalimentan, hoy se ve con más claridad que nunca lo imprescindible que es la sensatez de Cs. Gracias, @BalEdmundo, por tu dignidad.",ines-arrimadas-garcia,ciudadanos,Cs,0.03415580838918686,0.0007337679271586239,VOX,0.38679009675979614,VOX,0.0011919490061700344,0.0172454621642828,0.0008393254247494042
1385569784260141059,"Ratifico mi determinación de acudir a todos los debates electorales a defender el programa de Cs y, sobre todo, el proyecto de concordia y unión que ahora Madrid y toda España necesitan más que nunca. No permitamos que la radicalidad y los extremos se lleven por delante un país.",,,Cs,0.02803950197994709,0.0007734711398370564,VOX,0.07631081342697144,PSOE,0.0009321580873802304,0.010713854804635048,0.0011092510540038347
1385582559137083400,"📚 Sant Jordi es un magnífico día para recomendaros este libro de mi compañero @GuillermoDiazCs: ‘Grandes batallas en la pantalla’. La mejor mezcla de cine e historia con notas de humor. ¡Una genialidad! 👏

#DiaDelLibro2021 #23DeAbril https://t.co/WQronM7GkB",ines-arrimadas-garcia,ciudadanos,Cs,0.0038933686446398497,0.002305159345269203,PODEMOS,0.004398506600409746,Ciudadanos,0.002313077449798584,0.003940507769584656,0.002248399192467332
1385588058771312643,"Condeno las amenazas a Pablo Iglesias y las agresiones a Vox en Vallecas. Condeno el acoso que Cs sufre en Cataluña desde que nació y la violencia terrorista que aún hoy justifica Bildu. Me repugnan quienes diluyen cualquier ataque totalitario.

La democracia no es irreversible👇🏻 https://t.co/VYz3LE7olp",,,Cs,0.1234319657087326,0.0007379649905487895,PODEMOS,0.25235024094581604,PODEMOS,0.000838872161693871,0.11977672576904297,0.000706913007888943
1385725579647934467,"Si no votas a @BalEdmundo @Cs_Madrid corremos el riesgo de que los extremos y el enfrentamiento estén en el gobierno de Madrid!!
Solo hay una opción el #4M...@CiudadanosCs !!! https://t.co/0ONLHiYxzD",,,Cs,0.9375260472297668,0.004967960063368082,PODEMOS,0.9741477966308594,PODEMOS,0.011351444758474827,0.9490699172019958,0.00613665534183383
1385886984183427074,"Hoy participo en un acto con @Yolanda_Diaz_, @IreneMontero, @isaserras, @BeatrizGimeno1, @jessicaalbiach, @VeraNoelia, @VaneLillo y otras compañeras para hablar del futuro en igualdad que queremos construir.

📺 Podréis seguirlo en directo aquí: https://t.co/AjqIR2jbzz https://t.co/BC2cV2TCsq",pablo-iglesias-turrion,,Cs,0.003760430496186018,0.0028027668595314026,Ciudadanos,0.003784042550250888,PSOE,0.002811289159581065,0.0037073090206831694,0.002877310384064913
1385940894793277440,"Solo hay una opción que te lo da todo: democracia y concordia, buena gestión económica y políticas sociales con el corazón.
Esa opción es Cs y por eso Madrid #VotaCentro4M. Excelente acto hoy con @BegonaVillacis, @IgnacioAguado, @BalEdmundo e @InesArrimadas 🍊💪 https://t.co/hyMcpUcSvM",jose-maria-espejo-saavedra-conesa,ciudadanos,Cs,0.00622091768309474,0.001529415720142424,PODEMOS,0.007805275730788708,Ciudadanos,0.001726257731206715,0.006374582182615995,0.0015066786436364055
1385958229994352641,"Para que Madrid siga avanzando, la sensatez y la moderación de Cs en el gobierno son la mejor opción posible; para que no se eche a perder la concordia entre madrileños, Cs es imprescindible.

El #4M tiñamos las urnas de libertad, respeto y tolerancia👇🏻 https://t.co/v9l8XT3iWI",,,Cs,0.010927604511380196,0.001140052918344736,PODEMOS,0.03104148805141449,Ciudadanos,0.0013003300409764051,0.00919309537857771,0.0012370168697088957
1385962560051101700,"🍊💪🏼 No hay duda: si no queréis elegir entre economía o políticas sociales, si queréis libertad, si queréis unión y concordia, #VotaCentro4M 

Cada día estoy más orgullosa de formar parte de este gran proyecto. ¡Vamos, Cs! https://t.co/ZchDaYHiFS",,,Cs,0.007848638109862804,0.0012955082347616553,VOX,0.012685143388807774,PODEMOS,0.001723765511997044,0.008098367601633072,0.0013800279702991247
1386606219234840576,"Entre un PSOE inmerso en una competición con Podemos por el voto más radical y la opción no descartada por el PP de que Vox decida la vida de millones de madrileños, apelo a la unión de los moderados en torno al proyecto de concordia de Cs.

En @MasDeUno👇🏻
https://t.co/XK2fFKahNG",,,Cs,0.3004007339477539,0.0009099532617256045,PODEMOS,0.4278090298175812,PODEMOS,0.0010512546868994832,0.10241023451089859,0.0007616128423251212
1386706409899843590,"Condeno las amenazas a Iglesias, Marlaska y Reyes Maroto.

Condeno la violencia contra Vox en Vallecas.

Condeno la violencia que sufre Cs en Cataluña desde que nació.

Condeno la violencia terrorista que Bildu aún justifica.

Ya está bien.

https://t.co/GZOgVHXPOB",maria-munoz-vidal,ciudadanos,Cs,0.5256373882293701,0.0015471441438421607,PP,0.6036357879638672,PP,0.001729025854729116,0.5418993234634399,0.0015077039133757353
1386753688404905987,"Como servidor público, siempre he defendido el interés general de los españoles desde la Abogacía del Estado. Como en la Gürtel y otros casos sonados de corrupción. 

Yo quiero un Madrid limpio y sin extremos. Nuestro proyecto es más necesario que nunca porque #CsEsRegeneración https://t.co/P6yONdOlfb",,,Cs,0.838577389717102,0.0029568045865744352,VOX,0.9152184724807739,VOX,0.00433280598372221,0.8272674083709717,0.0028209262527525425
1386934502652620803,"En unos minutos estaré en @HerreraenCOPE.

Explicaré la importancia del proyecto de Cs para que Madrid siga siendo una tierra de futuro y, atendiendo a la polarización actual, de concordia. El #4M los madrileños darán un ejemplo de sensatez.

¡Os espero! https://t.co/5FuH8sRwi1 https://t.co/e8OEA3iCiU",,,Cs,0.004570765420794487,0.0019685719162225723,Unidas Podemos,0.005605265963822603,Ciudadanos,0.0020894333720207214,0.0043823388405144215,0.0020406905096024275
1386954207329193985,"Muchos discursos incendiarios que empañan la campaña electoral responden a una competición entre el PSOE y Podemos por el voto más radical y redundan en una polarización irrespirable.

Este #4M los moderados tienen en Cs la opción sensata y de concordia.
https://t.co/CtBj1cEyD2",,,Cs,0.02925403043627739,0.0007484882371500134,VOX,0.04549866169691086,PSOE,0.0007939852657727897,0.03151033818721771,0.0007282259175553918
1386995825784545289,"Ayer planteé a Rocío Monasterio un debate porque el #4M va de si el futuro de Madrid lo decide Cs o Vox.

Ha respondido faltando al respeto y llamándome “traidor”. Yo me jugué el puesto por defender la democracia española ante Sánchez. Sin insultos, sigo dispuesto a debatir👇🏻 https://t.co/0M2UfVLjFs",,,Cs,0.951553463935852,0.005443073809146881,PODEMOS,0.9725057482719421,PODEMOS,0.009513823315501213,0.9494262337684631,0.005293982103466988
1387339978787729409,"Votar moderación y libertad.
Votar a políticos de la sociedad civil. Votar la mejor gestión.
Votar corrupción cero. 
Votar avance en derechos sociales. 

Votar nunca es “tirar un voto”.

⁦@CiudadanosCs⁩ frena la fuga y crece entre el voto moderado. https://t.co/qsW7unC6yS",maria-munoz-vidal,ciudadanos,Cs,0.015881123021245003,0.0010334644466638565,PODEMOS,0.019265789538621902,Partido popular,0.001078666653484106,0.015588797628879547,0.001080687390640378
1387404599724814337,"🌳 Visitamos el Bosque Metropolitano de Madrid, el proyecto que Ciudadanos impulsa desde el Ayuntamiento. Rodeará la capital con 450.000 árboles y absorberá 170.000 toneladas de CO2.

Esto es Cs: progreso económico y cuidado del medio ambiente 👏 https://t.co/3ZjvloTm3c",ines-arrimadas-garcia,ciudadanos,Cs,0.003966839984059334,0.002744604367762804,PSOE,0.004831968806684017,PODEMOS,0.002778636757284403,0.004520133603364229,0.00230890279635787
1387447277804003330,En Cs no renunciamos a un Madrid líder en crecimiento económico ni a un Madrid pionero en protección del medioambiente. Proyectos como el Bosque Metropolitano prueban nuestro compromiso sostenible. Seguiremos impulsando una agenda verde desde el gobierno. https://t.co/fJYubYbXvP,,,Cs,0.004653877578675747,0.0023923045955598354,VOX,0.005312144756317139,Ciudadanos,0.0025716605596244335,0.004727826453745365,0.0023357693571597338
1387498085861969922,El Impuesto de Sucesiones ya es historia en Castilla y León. Cs consigue en dos años acabar con un impuesto injusto que castigaba a las familias y que el PP llevaba décadas manteniendo. Gran noticia para todos los ciudadanos de esta tierra. ¡Felicidades! 👏https://t.co/LdHrbXmO2D,ines-arrimadas-garcia,ciudadanos,Cs,0.020755797624588013,0.0007947133854031563,Vox,0.0630464255809784,Cs,0.0007947133854031563,0.026424655690789223,0.000727933831512928
1387512077279973380,"Hoy ha sido designado senador @jlmlagares por Andalucía. Hoy @Cs_Andalucia ha acertado en su propuesta y el @ParlamentoAnd ha elegido a un gran representante para los andaluces. 

Felicidades a todos.",guillermo-diaz-gomez,ciudadanos,Cs,0.0036563666071742773,0.0029133413918316364,Vox,0.005125107243657112,Cs,0.0029133413918316364,0.0037546290550380945,0.0028534061275422573
1387522126903656449,"Quiero agradecer de corazón a Esteban Ibarra, presidente de Movimiento contra la Intolerancia, que haya acudido al acto de @CiudadanosCs celebrado hoy en Chueca. Un hombre comprometido con la defensa de la dignidad de las personas y la libertad sin apellidos. Gracias, compañero. https://t.co/hzQV9IugFJ",,,Cs,0.0039362916722893715,0.002513907616958022,Unidas Podemos,0.004475823137909174,PSOE,0.002569298492744565,0.004048462025821209,0.0023910871241241693
1387700099522998274,"Los buenos indicadores no son casualidad. Se llaman @DeMairena y Cs al frente de la Economía:
👉🏻 Madrid suma 40.400 empleados el trimestre en el que en toda España se destruyeron 137.500 puestos de trabajo
👉🏻 Lideramos la tasa de actividad en todo el país https://t.co/kdXs71wOtM",,,Cs,0.015714671462774277,0.0009267679997719824,Cs,0.015714671462774277,PODEMOS,0.0019049131078645587,0.005256627220660448,0.0019182523246854544
1387783815590912003,"Agradecemos a nuestra familia liberal de @RenewEurope y @ALDEParty su apoyo a Cs y a nuestro candidato @BalEdmundo el próximo #4M.
Solo la moderación y la sensatez serán capaces de poner fin a la crispación de los bandos. https://t.co/lFYKr24G8i",jose-maria-espejo-saavedra-conesa,ciudadanos,Cs,0.007202300243079662,0.0014710872201249003,VOX,0.009000242687761784,Partido popular,0.001591075211763382,0.006239097565412521,0.0015597795136272907
1387833160617111557,"En Cs decimos alto y claro #InsultosNoToleranciaSI. El 4M tú también tienes la oportunidad de elegir y de votar para dejar atrás la crispación. 

#EligeCentro.
Vota @BalEdmundo https://t.co/s01ZDMVzQp",jose-maria-espejo-saavedra-conesa,ciudadanos,Cs,0.1078697070479393,0.0008000340894795954,PSOE,0.14163000881671906,VOX,0.0008694866555742919,0.07182648032903671,0.0007307323976419866
1387873881935990785,"Cs logra que el Parlamento Europeo exija la investigación del ‘Caso Neurona’ y la presunta corrupción de Podemos. ¡Gran trabajo, @JRBauza y todo el equipo! 👏

Trabajamos por la regeneración contra viento y marea, le pese a quien le pese. Por eso somos tan incómodos y necesarios. https://t.co/2ma3HEdIgp",ines-arrimadas-garcia,ciudadanos,Cs,0.23638033866882324,0.0009562351042404771,VOX,0.2515932321548462,VOX,0.001539329532533884,0.05583265423774719,0.0008538556285202503
1388247059485143040,"No tengo palabras para describir la emoción y el orgullo que hemos sentido hoy gracias a los increíbles @jovenesCs

Sois unos valientes: no solo no os conformáis sino que cuando lo fácil es alistarse en un bando, elegís levantar la bandera de la concordia

Este #4M por vosotros🧡 https://t.co/a3OtF3iuLW",,,Cs,0.010759899392724037,0.0013742049923166633,Unidas Podemos,0.015019192360341549,Ciudadanos,0.001458410988561809,0.01163520384579897,0.0012957848375663161
1388975841963618304,"Qué orgullosa estoy de la campaña de Cs. Sensatez, moderación y propuestas ante el fuego cruzado. Somos más los que queremos soluciones de futuro y no retroceder a un pasado de bandos. Vamos a demostrarlo en las urnas, vamos a llevar a @BalEdmundo al Gobierno de Madrid. Vamos 🧡 https://t.co/irQCbigQqQ",ines-arrimadas-garcia,ciudadanos,Cs,0.007130831480026245,0.001501188613474369,VOX,0.008702247403562069,Partido popular,0.001769905211403966,0.006055159959942102,0.001755044679157436
