twitter_id,original_text,slug,party_slug,comuni_toxic,comuni_very_toxic,fascis_toxic,fascis_very_toxic,most_toxic,most_very_toxic
1406319794186502149,"Una obra proyectada e iniciada por el Gobierno del @populares tras años de reclamación, como también proyectamos la conexión ferroviaria que el Gobierno social comunista ahora olvida. https://t.co/jygOz79im1",agustin-almodobar-barcelo,partido-popular,0.9861510396003723,0.028715437278151512,0.9936953186988831,0.13872037827968597,fascista,fascista
1406344363928604672,"Aleo Mariátegui: “Sólo VOX, por su vocación latinoamericana y anti comunista ha sacado la cara por Perú” https://t.co/QGjJDswOHZ",ivan-espinosa-de-los-monteros-de-simon,vox,0.012914800085127354,0.0012105965288355947,0.03626076504588127,0.0011541828280314803,fascista,comunista
1407408315072761857,"Está la derecha, la extrema derecha, los fascistas y, como guinda, los bufones de la extrema derecha. 

Que bochorno C’s de verles revolcarse en la última categoría",aina-vidal-saez,catalunya-en-comu,0.9949595928192139,0.9916723370552063,0.9947920441627502,0.995372474193573,comunista,fascista
1407425660570722312,"‼️Aquí @Eselkaos sacándole los colores a Olona y su fascismo cínico. 

¿Se han personado contra el PP? ¿En la Kitchen? ¿Contra la monarquía? Entonces que la ultra derecha no venga a vendernos motos de que luchan contra la corrupción https://t.co/HJp0IQOwGw",joan-mena-arca,catalunya-en-comu,0.9968487620353699,0.9866366982460022,0.994941771030426,0.9966537952423096,comunismo,fascismo
1407980237707751428,"Y Ciudadanos manteniendo pacto con el que indulta golpistas y comunistas de Podemos, los enemigos de España . https://t.co/vV3Ylwdili",francisco-jose-alcaraz-martos,vox,0.9503243565559387,0.009133716113865376,0.9814615845680237,0.041533246636390686,fascista,fascista
1408416827869437953,"El ⁦@WSJ⁩ publicó ayer que Bloom descubrió que investigadores chinos exigieron quitar datos de la secuencia del Coronavirus en Marzo de 2020, complicando así el esclarecimiento del origen del virus. La china comunista, borrando pistas. https://t.co/FZkYKS37Ss",juan-luis-steegmann-olmedillas,vox,0.3035970628261566,0.0012020441936329007,0.49728816747665405,0.0015574560966342688,fascista,fascista
1410158242433544196,"🤦‍♀️@pablocasado_: ""La guerra civil enfrentó a quienes querían democracia sin ley y quienes querían ley sin democracia"".

No conozco a ningún otro líder europeo que reivindique un golpe de estado fascista. Qué vergüenza este @populares arrastrado por VOX",joan-mena-arca,catalunya-en-comu,0.997246265411377,0.9641251564025879,0.9971189498901367,0.9789968729019165,comunista,fascista
1410276633995616258,"Para Sánchez si un enfermo mental manda una navaja es el regreso del fascismo. Pero si la GCivil concluye que un CDR quiere atentar contra mí y compañeros es exageración. Y lo negaron.
 
Del admisible jarabe democrático pasamos al tolerable agente termita. Solo si es contra el PP https://t.co/0XBxmSWIQF",pablo-casado-blanco,partido-popular,0.9889692068099976,0.03558338060975075,0.9920917749404907,0.06922401487827301,fascismo,fascismo
1411447559608995846,El #comunismo ya está aquí. https://t.co/yZOUDuXHFT,miguel-angel-castellon-rubio,partido-popular,0.9835313558578491,0.023563329130411148,0.9804716110229492,0.0195121131837368,comunismo,comunismo
1412346376168554497,"Esta foto de la presidenta de la asamblea constituyente chilena lo dice todo

Indigenismo, pro-aborto y el puño derecho cerrado. Inequívoco gesto comunista

El que no lo vea es porque no quiere verlo. No pretenden engañar a nadie https://t.co/GyBcJqCmK9",,,0.9358845949172974,0.005452361423522234,0.9807944893836975,0.0240206029266119,fascista,fascista
1412351421178126336,Ya en la Guerra Civil pactaron con los fascistas italianos entregar Bilbao sin pegar un tiro a cambio de ser bien tratados. Son muy cosmoplitas desde hace tiempo.  https://t.co/hcBPfvqLXq,guillermo-diaz-gomez,ciudadanos,0.9809340834617615,0.021828796714544296,0.9905632734298706,0.0988827496767044,fascista,fascista
1413850728406425604,"El problema de España es Sánchez, el que se tiene que ir es él.

Agota escudos humanos con 17 ministros purgados en 2 años y 5 crisis de gobierno que dejan un gobierno en crisis.

Más caos, despilfarro y radicalidad con los comunistas de su insomnio y los secesionistas mandando. https://t.co/ev1mQickOI",pablo-casado-blanco,partido-popular,0.993513286113739,0.22489382326602936,0.9958003163337708,0.6608821153640747,fascista,fascista
1414245427768184833,"El acoso y las amenazas a @eledhmel por parte de esos seres de luz de la izquierda comunista, indefinida, extravagante y multigénero, no es sino síntoma de que la verdad escuece y de que no hay ni pizca de inteligencia ni de decencia en ellos. Ánimo Carla, querida.",joaquin-robles-lopez,vox,0.9931435585021973,0.997162401676178,0.9930943250656128,0.9976589679718018,comunista,fascista
1414302255168245761,"🇨🇺 Históricas movilizaciones sociales en Cuba clamando por la libertad. Todo nuestro apoyo desde España, valientes. Vuestra causa es la nuestra.

El Gobierno Sánchez debe mostrarse desde ya y sin ambages al lado de los demócratas y enfrente de la dictadura comunista.

#SOSCuba https://t.co/RnIcJCcvjq",ines-arrimadas-garcia,ciudadanos,0.8352782726287842,0.0029523263219743967,0.9285803437232971,0.006364776752889156,fascista,fascista
1414501494385168386,"La causa de los demócratas cubanos es la de todos los demócratas. El Gobierno de España no puede seguir sin mostrar su firme apoyo al histórico clamor contra la represión y la dictadura comunistas. Tras haber tomado posesión, el ministro @jmalbares debe pronunciarse de inmediato.",,,0.030478553846478462,0.0007592228939756751,0.08435036242008209,0.0007426769589073956,fascista,comunista
1414601400714252291,"Biden apoya la libertad y la democracia de Cuba, mientras Sánchez confirma a todos sus ministros comunistas que alaban la dictadura castrista.

A Garzón le gusta el Sánchez al punto. Le desafía porque no puede cesarlo. No hay un gobierno unido sino una confederación de radicales. https://t.co/fuRdOuNJp8",pablo-casado-blanco,partido-popular,0.9963862895965576,0.9738165736198425,0.9958522319793701,0.9903138279914856,comunista,fascista
1414622738199859201,"#ComunismoOLibertad 
#PatriaYVida 
#SOSCuba 

Desde Madrid acompañamos a los cubanos que exigen Libertad y democracia tras 60 años de dictadura comunista.

España debe liderar la  respuesta europea exigiendo el respeto de los derechos humanos y la llegada de la democracia a Cuba https://t.co/BYpp1IPeGo",jaime-eduardo-de-olano-vela,partido-popular,0.04099857807159424,0.0007696617976762354,0.09976590424776077,0.0008377902559004724,fascista,fascista
1414635201255415812,Con los hermanos cubanos apoyando su lucha por la libertad frente al comunismo. En la embajada cubana en Madrid con @hermanntertsch @monasterioR @Ortega_Smith @VOX_Congreso @vox_es https://t.co/WB3qo9sq9X,luis-gestoso-de-miguel,vox,0.00743328221142292,0.0013680389383807778,0.009815705940127373,0.0013652854831889272,fascismo,comunismo
1414968389773180931,"El régimen de Cuba es una dictadura. Una dictadura comunista.

Es lamentable que el Gobierno de Sánchez no pronuncie estas palabras. 

A los demócratas cubanos: España es mucho más que su gobierno, y la inmensa mayoría de españoles estamos con vosotros🇨🇺🇪🇸
https://t.co/GtynKDsSXj",,,0.9938965439796448,0.32296445965766907,0.9952852129936218,0.5822720527648926,fascista,fascista
1415233311321042944,"Mientras hay miembros del Gobierno de España que dicen que nuestra democracia es de baja calidad, no hay ni uno solo que se atreva a decir que en Cuba hay una dictadura comunista. Es una vergüenza. Nuestro apoyo incondicional al pueblo cubano en su lucha contra la tiranía 🇨🇺🇪🇸 https://t.co/lwjL0f7TTf",ines-arrimadas-garcia,ciudadanos,0.9931578040122986,0.1233251616358757,0.9940926432609558,0.16325633227825165,fascista,fascista
1415564660993138689,Artículo 5 de la Constitución cubana. Sánchez niega la condición de dictadura y una iletrada de Unidas Podemos dice que Cuba no es comunista. Debería existir el delito de lesa ignorancia. https://t.co/gETqCfKYBd,mario-garces-sanagustin,partido-popular,0.9946617484092712,0.9931386113166809,0.9947651624679565,0.9933182001113892,fascista,fascista
1415590239670788099,"1) Claudio Sánchez-Albornoz, historiador insigne, ""presidente de la República en el exilio"" (1962-71):

""Si llegamos a ganar la guerra nosotros [el bando ""republicano""], se hubiera establecido el comunismo en España. ¿Cómo podía estar yo al lado de gente que ha matado a 12.000...",francisco-jose-contreras-pelaez,vox,0.07594675570726395,0.0007307975320145488,0.3344123065471649,0.0010310638463124633,fascismo,fascismo
1415757502633975808,"Los que hablan de ""poner un cordón sanitario a VOX"" sueñan con este (es el que han aplicado históricamente los comunistas): https://t.co/LBzvsshLTN",francisco-jose-contreras-pelaez,vox,0.9914289116859436,0.06188909336924553,0.9968510270118713,0.7987732291221619,fascista,fascista
1416307497263108097,"Estatua a un homofobo comunista.
Vota y opina: ¿Crees que Oleiros debería retirar la estatua dedicada al Che? https://t.co/FlExIrRXTz",francisco-jose-alcaraz-martos,vox,0.9925754070281982,0.15936191380023956,0.9958356618881226,0.5684512257575989,fascista,fascista
1416396554148192256,"Hay voces en la Iglesia que denuncia los abusos de la dictadura comunista  cubana 

Es legítimo alzarse contra los tiranía.

Está en la doctrina de la Iglesia 

https://t.co/wI7gc8pN3U",,,0.0598706416785717,0.0008694527205079794,0.0871066227555275,0.0008518256945535541,fascista,comunista
1416732075403661315,"Recordemos que, los nietos del fascismo que perpetró un golpe de estado en el que traidores vistiendo uniforme se levantaron contra el pueblo de ESPAÑA, están sentados en el Congreso. 

Su primer acto, asesinar a militares leales al juramento que empeñaron, lealtad a España.",zaida-cantera-de-castro,psoe,0.9899309873580933,0.14146120846271515,0.9942134022712708,0.5427213907241821,fascismo,fascismo
1416801406795849728,"Reflexionar, mirarse a uno mismo, saber que todos los humanos somos iguales y que todos los pueblos migramos. Decir no al fascismo como imperativo para la buena humanidad. Gracias a Isaac Viciosa por esta “Carta aclaratoria tras la polémica con Katir”.  https://t.co/Vf5hJfM62v",anton-gomez-reino-varela,podemos,0.006562250200659037,0.0013874031137675047,0.008254307322204113,0.0012166394153609872,fascismo,comunismo
1417048666242756608,La bárbara y muy fascista Edad Media (catedral de León) https://t.co/Na06EbkUfw,francisco-jose-contreras-pelaez,vox,0.8528448343276978,0.004319760948419571,0.4119333028793335,0.0016058931360021234,comunista,comunista
1418499239617904641,"Dice El País que Pedro Sánchez “se ha alejado de las posiciones extremistas”de los cubanos de Florida, en su entrevista en la CNN

Para la izquierda, rechazar y combatir una dictadura comunista es “extremismo”",edurne-uriarte-bengoechea,partido-popular,0.9531121850013733,0.0073693618178367615,0.9681568741798401,0.010902348905801773,fascista,fascista
1420793389797281794,"El historial de los comunistas peruanos. ¿Conocen al ""presidente Gonzalo""?

""Desató el terror más despiadado: sus secuaces degollaban, quemaban vivas, dinamitaban a sus víctimas; les cortaban las orejas, la lengua, les sacaban los ojos"".

De @MarioNoyaM : https://t.co/1Vj61gny34",francisco-jose-contreras-pelaez,vox,0.012783898040652275,0.002285189460963011,0.011362822726368904,0.0022758187260478735,comunista,comunista
1421458008068997124,"La Inquisición española, la Revolución francesa y el comunismo: ¿cuál provocó más muertos? https://t.co/Bh4ZglqMIl a través de @ElentirVigo",juan-luis-steegmann-olmedillas,vox,0.007620344404131174,0.0016151099698618054,0.009093777276575565,0.001457418198697269,fascismo,comunismo
1422254957714153474,"Una negra y un negro medallistas olímpicos y españoles justificándose que son españoles a pesar de ser negros. 

El racismo y la xenofobia haciendo mella mientras políticos fascistas critican que unos negros puedan representar a España.

Negros españoles haciendo patria de España",zaida-cantera-de-castro,psoe,0.6634790301322937,0.003666384844109416,0.8824060559272766,0.01061613392084837,fascista,fascista
1422511229910798336,¿Pero no era 'comunismo o libertad'? - #SoloQuedaVox  https://t.co/ve2ENlZ392,emilio-jesus-del-valle-rodriguez,vox,0.5878707766532898,0.0013543011154979467,0.4788345694541931,0.0011884759878739715,comunismo,comunismo
1427913880861356037,"Un día como hoy hace 85 años los fascistas fusilaron e hicieron desaparecer a uno de nuestros poetas más colosales. 

Le asesinaron por pensar diferente, por vivir libremente, por hacer pensar y sentir a los demás. 

A él y a tantos que permanecen en cunetas les debemos todo aún.",ione-belarra-urteaga,unidas-podemos,0.039267003536224365,0.0017586154863238335,0.0516408272087574,0.0017244425835087895,fascista,comunista
1427917938892361729,"@VOX_Congreso no cayó en la trampa sanchocomunista.Lo importante era que el 70% estuviera vacunado completamente ANTES del verano. El gobierno se puso la fecha límite el 19 de Agosto. Pues bien,hoy, 19 de Agosto,  faltan tres millones para lograrlo. Darias suspendida.",juan-luis-steegmann-olmedillas,vox,0.9691588878631592,0.009094812907278538,0.9893781542778015,0.041991379112005234,fascista,fascista
1429115691802763268,"Financiado con dinero público?
Son este tipo de cosas las que no debemos tolerar. El fascismo se esconde también tras algunas sotanas. Quienes niegan la pederastia en la iglesia intentan combatir una ley justa y garantista como la de la #Eutanasia 👇🏻

https://t.co/60ENGzYadh",,,0.9770526885986328,0.011430379934608936,0.9669350385665894,0.00821675080806017,comunismo,comunismo
1430057467652845586,"""Los supuestos grupos antifascistas se están dedicando a señalar a los empresarios simpatizantes de VOX a modo de conseguir que dejen de hacerlo, para que se acobarden como lo hacían en las Vascongadas. Y, ¿el señor Feijóo? No se sabe""

https://t.co/aC2W8bQv5g",carla-toscano-de-balbin,vox,0.19522273540496826,0.001082120812498033,0.18868760764598846,0.0011076898081228137,comunista,fascista
1430192220074827780,"Los asesinados, gaseados, torturados, mutilados, las mujeres violadas, niños ejecutados por el comunismo, son daños colaterales, una anécdota.

Vidas que no valían nada frente a la idea que todavía pregonan algunos, lo hacen pisoteando la mayor montaña de cadáveres de la historia https://t.co/ZQf7XrqRav",guillermo-diaz-gomez,ciudadanos,0.662288248538971,0.001902148243971169,0.6896332502365112,0.0020487059373408556,fascismo,fascismo
1432243129026072583,"Cuando gobernaba el PP acuñaron el término “pobreza energética” para acusar al gobierno del alza de los hidrocarburos 

Ahora gobiernan ellos y este es el resultado 

El comunismo siempre empeora la situación que critican

https://t.co/3mibw6RfEY",,,0.9335830807685852,0.004370902664959431,0.9805737137794495,0.015003321692347527,fascismo,fascismo
1432622909168791554,"No son trabajadores públicos señora vicepresidenta comunista 

Los trabajadores tienen horario y se le pagan las horas extras 

Y a ningún trabajador se le puede exigir que entregue su vida por la patria 

Los militares son mucho más que trabajadores públicos https://t.co/OVoiX0oXuP",,,0.9820548892021179,0.023883819580078125,0.9939417839050293,0.18509022891521454,fascista,fascista
1432975515875414017,"⁦@vox_es⁩ exige al Gobierno acciones diplomáticas contra el embajador de Cuba en España por llamarles ""fascistas"" - #SoloQuedaVox  https://t.co/QuvAGlUgjt",emilio-jesus-del-valle-rodriguez,vox,0.9692797064781189,0.011680843308568,0.9747573733329773,0.019223567098379135,fascista,fascista
1433174561063845888,"Los socialistas de #Bejar llevan 120 años luchando por la libertad y la igualdad. No es la primera vez que nuestra sede es atacada.

Ni un bote de pintura ni un fascista con brocha nos va a parar. https://t.co/4qUAKFkrds",david-serrada-pariente,psoe,0.9890962243080139,0.058712054044008255,0.9939060807228088,0.20803233981132507,fascista,fascista
1433796764855898112,"En breve os contaré la historia de los Escamots con los que se fotografía @LauraBorras 

Os adelanto que Mussolini es un referente para ellos. Sin ironías ni exageraciones. Fundados por asesinos, fascistas y los personajes más turbios de Cataluña. https://t.co/QNkoen4nKw",guillermo-diaz-gomez,ciudadanos,0.9951725602149963,0.8111221194267273,0.9897856116294861,0.23175296187400818,comunista,comunista
1433799646221045769,"Fantástico!

Senadores del #PAN reciben a líder de #VOX y firman “carta contra el comunismo” https://t.co/iMngbu1kjR",ivan-espinosa-de-los-monteros-de-simon,vox,0.772842526435852,0.0021529244258999825,0.9902279376983643,0.06824348121881485,fascismo,fascismo
1434081014125580292,"Masculinizar (ABC), 04 sept 2021 
El partido comunista Chino quiere masculinizar a sus hombres. Las comunistas españolas , feminizarlos. Hay que avisar a ChiChinPin.  https://t.co/xw7rOT8sEH",juan-luis-steegmann-olmedillas,vox,0.9932530522346497,0.9978491067886353,0.9927757978439331,0.9979785084724426,comunista,fascista
1435531507964289024,"“El fascismo sería entonces de izquierda, izquierda pura, se consideraban sucesores de la Revolución Francesa además, jacobinos, y después el fascismo arrasa con la religión” Gustavo Bueno. ¿Insua habrá leído esto?",joaquin-robles-lopez,vox,0.951747715473175,0.007685526739805937,0.9672278165817261,0.012117167003452778,fascismo,fascismo
1435726087510708224,Armas comunistas: del piolet a las confiscaciones de grano. La inagotable erudición de ⁦@RRdelaSerna⁩ : https://t.co/yZS1xxCK1g,francisco-jose-contreras-pelaez,vox,0.06230655685067177,0.0012051620287820697,0.2699488699436188,0.001949403085745871,fascista,fascista
1437333678242287619,"Está tarde participaré en el homenaje de @CCOOMadrid al militante comunista Pedro Patiño en el 50 aniversario de su asesinato.

Tenemos que seguir trabajando para recuperar la memoria democrática y reivindicar la lucha del movimiento obrero por la democracia y las libertades. https://t.co/WoZZG4VVoa",enrique-fernando-santiago-romero,sin-partido,0.003814682364463806,0.0031352767255157232,0.005458930507302284,0.002165925921872258,fascista,comunista
1439519102498975749,"Contra esta gente, pie en pared y ni un paso atrás. Al fascismo se le vence👉🏽 Un grupo de extrema derecha marcha por Chueca al grito de ""fuera maricas de nuestros barrios"" https://t.co/rpNaz2aHP7",juan-antonio-lopez-de-uralde-garmendia,podemos,0.9859035015106201,0.03208078816533089,0.9877695441246033,0.05769195035099983,fascismo,fascismo
1439875503041794052,"Luego diréis 
Que somos 
Cinco o seis!!
La manifa de @solidaridad_esp contra el tarifazo eléctrico social-comunistarra. Una masiva asistencia censurada por toda la prensa progre. #SoloQuedaVox 💪🏻💪🏻🇪🇸🇪🇸 https://t.co/ElkOpVZ2ob",luis-gestoso-de-miguel,vox,0.9968359470367432,0.9866645336151123,0.9968032836914062,0.9876121878623962,comunista,fascista
1440562328206905357,"Sánchez siempre elige a los más radicales: comunistas, golpistas, herederos de ETA…
¡Pierde España!

#HayAlternativa https://t.co/ftvhgqZZUj",jaime-eduardo-de-olano-vela,partido-popular,0.9951968789100647,0.9954120516777039,0.9949036836624146,0.9958851933479309,comunista,fascista
1441113618628497413,"La Fundación de Vox desafía al Gobierno de Perú reuniéndose con la oposición en el Congreso para combatir el comunismo, por @Maiteloureiro_ https://t.co/AKy3kqX7LO",juan-jose-aizcorbe-torra,vox,0.015211518853902817,0.0008912324556149542,0.0883454829454422,0.000702378514688462,fascismo,comunismo
1441313710295826439,"El PP propuso una PNL pidiendo que se prohíba la apología del comunismo.

Mi intervención, a partir del minuto 3:55 de este vídeo: 

https://t.co/SeCJQ0JJKw",francisco-jose-contreras-pelaez,vox,0.007051167543977499,0.0016102500958368182,0.009685974568128586,0.001309291459619999,fascismo,comunismo
1442426880993464330,"Más de un millón de personas han votado en Berlín, capital del país más poderoso de Europa (56% a favor, 39% en contra), expropiar 240.000 viviendas a los grandes especuladores.

En España, las televisiones te dirán que eso es narcocomunistafiloetarrapopulistabolivariano.",pablo-echenique-robba,podemos,0.9960818886756897,0.6463533639907837,0.9965507984161377,0.7983025312423706,fascista,fascista
1442489864755220490,"Un placer haber sido invitado a la @fiestaPCE para debatir sobre la unidad popular con @sirarego, @ionebelarra y @juralde.

Aquí mi intervención, con un recuerdo para comunistas ejemplares, democráticos e internacionalistas, como Maria Salvo, Neus Català o Paco Fernández Buey👇🏾 https://t.co/u5fEvD5Ea8",gerardo-pisarello-prados,catalunya-en-comu,0.004635078366845846,0.0019816451240330935,0.006115835625678301,0.0014862308744341135,fascista,comunista
1443524138228985857,"""VOX califica la norma de ""propaganda"" y denuncia que su finalidad es ""inculcar en las mentes de los españoles la ecuación según la cual izquierda equivalió y equivaldrá siempre a democracia y libertad, y derecha a fascismo y represión"""":

https://t.co/c3lTT7SS2G",francisco-jose-contreras-pelaez,vox,0.8444913029670715,0.0022669718600809574,0.9338951110839844,0.004673907533288002,fascismo,fascismo
1443871227211403281,"De 38 congresistas convocados, solo 5 asisten a la cita con Ayuso en el Capitolio.

Vaya ingratos. Perder semejante ocasión para adentrarse en tesis fascinantes como ""indigenismo es comunismo"" y ""libertad es beberte una cerveza y encontrarte con tu ex""
https://t.co/ciPd3X2Zwe",gerardo-pisarello-prados,catalunya-en-comu,0.9920787215232849,0.9971745014190674,0.9920610189437866,0.9974083304405212,comunismo,fascismo
1444704594492334083,Oigo en un anuncio de OXFAM el palabro INJUSTICIA CLIMÁTICA. Les sugiero que lo pongan en mandarín en la TV comunista China. A ver si les deja el país más contaminador del mundo.,juan-luis-steegmann-olmedillas,vox,0.9947444200515747,0.995965838432312,0.9939945340156555,0.996572732925415,comunista,fascista
1447330520497524742,"Con Fernando Juan Marrero, oficial de la armada cubana en #Viva21 Viva Cuba Libre! ¡ Viva España!  ¡ Fuera comunistas de Cuba y de España! https://t.co/dO8Mn7wiSJ",juan-luis-steegmann-olmedillas,vox,0.028334252536296844,0.0010109064169228077,0.37993156909942627,0.0019890922121703625,fascista,fascista
1451124683336736770,"Al fascismo se le mira a la cara. En este vídeo y en su día a día @monicaoltra es un referente de valentía y compromiso político👇
https://t.co/FNPK2SmJlV",jaume-asens-llodra,catalunya-en-comu,0.00815325602889061,0.0012733781477436423,0.008704925887286663,0.0012230502907186747,fascismo,comunismo
1452000050750672903,"¿Serán todas fascistas?
https://t.co/d7jYskjGue",ivan-espinosa-de-los-monteros-de-simon,vox,0.805474042892456,0.0028496398590505123,0.9807192087173462,0.027499448508024216,fascista,fascista
1453005535004041219,"Queremos dejar claro que somos un barrio antifascista, antirracista y multicultural 

Pero los MENAs me los va sacando, porque aquí no se aguanta más 

#larealidadestozuda https://t.co/HLdqMyTdLr",,,0.8504623174667358,0.0029917731881141663,0.9305421710014343,0.006249068304896355,fascista,fascista
1450838599511982094,1-La luz + cara d la historia 2-La gasolina + cara d la historia 3-Pago x circular x autovías 4-Subida Generalizada d impuestos 5-Nueva subida cuota autónomos 6-La deuda + grande d la historia. 7-Caída d inversión extrajera. #gobiernodelaruina #socialcomunismooprosperidad,vicente-betoret-coll,partido-popular,0.9767596125602722,0.0166185162961483,0.9741001725196838,0.014979985542595387,comunismo,comunismo
1451289729366958080,Valladolid con @Santi_ABASCAL y contra el comunismo globalista. España ha despertado! . 🇪🇸#AgendaEspaña #SoloQuedaVox https://t.co/bYaK68bSqw,luis-gestoso-de-miguel,vox,0.9879967570304871,0.05446935445070267,0.9948773980140686,0.33277827501296997,fascismo,fascismo
1452597606555820040,La Ministra comunista se desmarca de @PODEMOS en la petición del partido de dimisión de Batet. ¿A quién se creerá que debe la Vicepresidencia? https://t.co/QFaPW3yH5P,,,0.9396368265151978,0.005748986732214689,0.9850735068321228,0.03690172731876373,fascista,fascista
1452259606600761357,"Me pregunto ¿qué piensa hacer @agaramendil y la @CEOE_ES ante la ofensiva contra la Reforma Laboral de unos sindicatos corruptos (que dan su apoyo a los presos de ETA) y de una ministra comunista, mas allá de mostrar “su desacuerdo”?

¿Alguna idea mas?",marcos-de-quinto-romero,,0.9969615340232849,0.9749622344970703,0.9967674016952515,0.9826201796531677,comunista,fascista
1452959440676790272,"Vale, nos han pillado. La ILP del Mar Menor es un plan socio-comunista para dotar de derechos al Mar Menor y para que el agronegocio -que está detrás de VOX- deje de envenenarlo. Lo bueno es que ya tenemos 500.000 firmas para que el plan siga adelante🥳😂 
https://t.co/ZsUnPehLUl",javier-sanchez-serna,podemos,0.939480185508728,0.005294167902320623,0.9503167867660522,0.005846824496984482,fascista,fascista
1451880171435405315,"Las feministas no pueden negar la verdad: que en el fondo las mujeres les importan un bledo. 
La ley del ""sólo sí es sí"" 
viola derechos fundamentales, la presunción de inocencia, la igualdad, la libertad y el sentido común. 

Gobierno socialcomunista, el violador eres tú👉 https://t.co/JRUHp2N9PU",carla-toscano-de-balbin,vox,0.9958239793777466,0.9936988353729248,0.9957155585289001,0.9941459894180298,comunista,fascista
