twitter_id,original_text,slug,party_slug,party_original,toxic_original,very_toxic_original,most_toxic_party,most_toxic_party_toxicity,most_verytoxic_party,most_verytoxic_party_toxicity,PARTIDO_toxic,PARTIDO_verytoxic
1400428787918118914,"Celebramos en Toledo con toda solemnidad día  del Corpus Christi . 
Un día de alegría , Cristo hoy está con todos nosotros en la calle. 
Gracias a nuestra Academia de #infanteria de #Toledo por rendir todos los honores.
Junto a @MariscalZabala y
@dariveg  @MariaRamosFdVOX https://t.co/ym48Krey0s",ines-maria-canizares-pacheco,vox,VOX,0.005067635327577591,0.0029054859187453985,Unidas Podemos,0.006678936071693897,Partido popular,0.002955986652523279,0.005074376240372658,0.0028486521914601326
1401150605784145926,"“DESCARO INFINITO” Artículo de Ignacio Gil Lázaro, Diputado de ⁦@VOX_Congreso⁩ #SoloQuedaVox https://t.co/2oW1pSYq6I",emilio-jesus-del-valle-rodriguez,vox,VOX,0.8212652206420898,0.0021467325277626514,PP,0.8847733736038208,Unidas Podemos,0.0031441631726920605,0.8452205657958984,0.0025708863977342844
1402389366471860225,"""El nuevo Estatuto murciano incluye a Murcia en ese proyecto federalizante absurdo consistente en cuartear la soberanía nacional en 17 feudos al parecer autusuficientes y autogobernados"".

@JoaquinRobles55 (VOX): https://t.co/MAW8xmlC94",francisco-jose-contreras-pelaez,vox,VOX,0.0422615222632885,0.0007215352379716933,PODEMOS,0.2360285371541977,PODEMOS,0.000816101732198149,0.047535479068756104,0.0007109612924978137
1402522845293514758,"España no necesita a VOX, ya les tenemos a ustedes. Ustedes no tienen proyecto de país. Este gobierno es heredero del desastre de su partido. No nos ayudan, la plaza de Colón es la nada. @carmencalvo_ en @Congreso_Es dirigiéndose a Cuca Gamarra y al PP https://t.co/mO7BXevlWd",,,VOX,0.9970290064811707,0.9835039377212524,PP,0.9973704814910889,VOX,0.9835039377212524,0.9972551465034485,0.9488338828086853
1402527562002280449,"El portavoz del PP critica a la ministra de Transición Ecológica por la subida de un 43% en el precio de la energía.

Lo que no explica es que la Ley de Cambio Climático -a la que sólo se opone VOX- va a agravar esto.",francisco-jose-contreras-pelaez,vox,VOX,0.013150929473340511,0.0011423781979829073,Unidas Podemos,0.03197191283106804,VOX,0.0011423781979829073,0.0198950357735157,0.0009548358502797782
1402591053744685058,"Hoy el PP y VOX han venido a la #SesionDeControl otra vez con la cantinela de que su reforma laboral fue maravillosa. Aquí están los datos. 

Con el PP tardamos 10 años y 11 meses en recuperar el nivel pre-crisis de afiliación a la Seguridad Social. 

Con Unidas Podemos, 15 meses https://t.co/vQw1qQnzZK",lucia-munoz-dalda,podemos,VOX,0.25006115436553955,0.0008054245263338089,VOX,0.25006115436553955,PSOE,0.0009266889537684619,0.02228756621479988,0.00086605065735057
1402914578749665282,"El repaso que le está dando ahora mismo en el debate de la #LeyRider la VP y Ministra de Trabajo @Yolanda_Diaz_ a los representantes del sindicato vertical (VOX) es de época.

En todos los campos, especialmente en el laboral, frente al nuevo falangismo, Derechos y más Derechos.",anton-gomez-reino-varela,podemos,VOX,0.9451158046722412,0.005177649203687906,Ciudadanos,0.9666183590888977,Ciudadanos,0.008395615965127945,0.9108787775039673,0.0038238440174609423
1402974094962868226,"El PP y VOX han votado contra la creación de una Fiscalía Europea para luchar y perseguir delitos economicos, corrupcion y blanqueo de capitales contra la UE. 

Quieren que España siga siendo líder en saqueo de recursos de la UE  como durante los gobiernos del PP. https://t.co/K5MR97cBY3",enrique-fernando-santiago-romero,sin-partido,VOX,0.9973010420799255,0.9681735634803772,Vox,0.9973695278167725,VOX,0.9681735634803772,0.9972928166389465,0.8841578960418701
1402977625006616576,"El PP y VOX han votado en contra de la creación de una Fiscalía Europea para luchar y perseguir delitos económicos, de corrupción y blanqueo de capitales contra la UE. 

Quieren que España siga siendo líder en saqueo de recursos de la UE  como durante los gobiernos del PP. https://t.co/HH5pkyCNSL",enrique-fernando-santiago-romero,sin-partido,VOX,0.9970295429229736,0.7386500835418701,VOX,0.9970295429229736,VOX,0.7386500835418701,0.9966239929199219,0.600092351436615
1403334198572748801,"VOX nunca ha negado la violencia contra la mujer

Negamos que la causa de esa violencia sea una ""masculinidad tóxica"" que hay que erradicar impartiendo talleres de ""deconstrucción"" de la masculinidad a nuestros jóvenes

Justicia para las víctimas y castigo a los agresores",,,VOX,0.025677762925624847,0.0010274505475535989,VOX,0.025677762925624847,Cs,0.0015413265209645033,0.01493464969098568,0.0011986296158283949
1403374351425150978,"La educación socioemocional de los niños y jóvenes, buena y necesaria (y hablo como experta en el tema), se convierte en caballo de Troya de la ideología progre impulsada por el PP en la Comunidad de Madrid. Desde @VOX_Congreso siempre alerta
Abro hilo 🧶 
https://t.co/t3XJKrTIKa https://t.co/sexWY3SQL6",,,VOX,0.9916957020759583,0.05026111751794815,PP,0.9920997023582458,PP,0.055817198008298874,0.991510272026062,0.04723005369305611
1403612641977901056,"Dice el PP que no tiene nada que ver con VOX
Por eso el PP gobierna gracias a VOX
Por eso el PP pacta con VOX 
Y por eso el PP se manifiesta donde quiere VOX 
Dos caras para una misma política",jose-zaragoza-alonso,psoe,VOX,0.7850962281227112,0.0022704245056957006,VOX,0.7850962281227112,VOX,0.0022704245056957006,0.08968322724103928,0.0008226260542869568
1403652827969425410,"Los negacionistas de la violencia de género, empezando por los partidos políticos como VOX, son un peligro y una amenaza para las mujeres de este país.
Y el feminismo salva vidas.",adriana-lastra-fernandez,psoe,VOX,0.9939098358154297,0.9964313507080078,Unidas Podemos,0.9961079955101013,VOX,0.9964313507080078,0.9949648976325989,0.992893636226654
1403767152000241668,"“Desde @VOX_Congreso pedimos en enero 2020 modificar la Directiva Hábitat y un Plan de Gestión Cinegética, para solucionar los problemas de los ataques del lobo en nuestra provincia, que sufre más del 50% del total de los ataques de todo Castilla y León” 

https://t.co/uuly1ZYl6l https://t.co/prWop4uE4f",,,VOX,0.004629019647836685,0.0024978267028927803,Unidas Podemos,0.005040028598159552,Ciudadanos,0.002587265335023403,0.004541034810245037,0.002600706648081541
1403973745207918595,"Los protagonistas de la foto de Colón: VOX, PP y Cs, siguen igual, unidos en la confrontación, en la parálisis. Como sociedad debemos mirar hacia el futuro, cementar la convivencia de todos y todas y esforzarnos por el reencuentro.
#PorElReencuentro https://t.co/6IF92c2Crg",maria-luz-martinez-seijo,psoe,VOX,0.7679484486579895,0.0022792567033320665,Unidas Podemos,0.8437173962593079,Vox,0.002634035423398018,0.2629578411579132,0.0008462651749141514
1403997745833250819,Calentando motores en la manifestación de Colón junto a la estatua de Blas de Lezo. PAREMOS LOS INDULA DELINCUENTES GOLPISTAS!! 💪🏻🇪🇸 #SoloQuedaVOX https://t.co/0mXw2i5q2S,luis-gestoso-de-miguel,vox,VOX,0.9944082498550415,0.996161699295044,Unidas Podemos,0.9951553344726562,PODEMOS,0.9963020086288452,0.9944782257080078,0.9957018494606018
1405260082766569475,"Aquí un trocito de las pasiones que levantamos a diario en el Congreso.

""Señorías de VOX, no les estoy preguntando si son gente, porque gente somos todos; les estoy preguntando si son personas""

Ánimo a mis compañeros @TeresaGdVinuesa, @pcalvoliste, @RuizSolas y @pedro_fhz. https://t.co/VicstpR0t4",rocio-de-meer-mendez,vox,VOX,0.9444464445114136,0.006007264368236065,Unidas Podemos,0.9511702060699463,PSOE,0.006500579416751862,0.48909446597099304,0.0010649312753230333
1405479709027323912,".@LuisGestoso (VOX): ""Vds. quieren meter en todos los organismos públicos a todos sus grupúsculos de extrema izquierda y ecologistas, asociaciones afines, etc., suplantando a la soberanía popular"". https://t.co/GHZ23bboAr",francisco-jose-contreras-pelaez,vox,VOX,0.26194462180137634,0.0009779363172128797,PODEMOS,0.45814403891563416,PODEMOS,0.001229269546456635,0.24433161318302155,0.0010236888192594051
1405777336771899394,"Buenos días, #Alicante! Hoy pasaremos el día apoyando a @vox_alicante @VOX_Valencia y a nuestros diputados nacionales @mestremanuel Eduardo Ruiz, y José María Sánchez, así como a nuestros miles de afiliados y simpatizantes de la provincia. Un lujo estar aquí! https://t.co/cms6S7vhJR",ivan-espinosa-de-los-monteros-de-simon,vox,VOX,0.004265193361788988,0.0025334565434604883,Unidas Podemos,0.0045483652502298355,Ciudadanos,0.00260754581540823,0.0041627101600170135,0.002600677078589797
1406157057531781121,"Dijo ayer MMM (Mónica Médica y Madre): ""El ""A Madrid se viene a hacer lo que a uno de le da la gana"" es la traducción cañí del laissez faire defendido por Adam Smith y Friedrich Hayek hace dos siglos"".

Hayek murió en 1992. Estos son los que nos llaman ignorantes a los de VOX. https://t.co/ugtL9ck8Tt",francisco-jose-contreras-pelaez,vox,VOX,0.9208962917327881,0.004582682624459267,PP,0.9592199921607971,PSOE,0.007583679631352425,0.7219542860984802,0.0016212010523304343
1406174814440722433,"“ACTO DE TRAICIÓN”. Artículo de Ignacio Gil Lázaro, diputado de ⁦@VOX_Congreso⁩ https://t.co/ARZg8OZU7e",emilio-jesus-del-valle-rodriguez,vox,VOX,0.016934938728809357,0.0008951843483373523,VOX,0.016934938728809357,PSOE,0.001699488959275186,0.007506789639592171,0.0013210739707574248
1406344363928604672,"Aleo Mariátegui: “Sólo VOX, por su vocación latinoamericana y anti comunista ha sacado la cara por Perú” https://t.co/QGjJDswOHZ",ivan-espinosa-de-los-monteros-de-simon,vox,VOX,0.012914800085127354,0.0012105965288355947,Unidas Podemos,0.02742697112262249,Partido popular,0.001304108533076942,0.023242341354489326,0.000910185684915632
1407051747982516234,El 10 de junio de 2019 @VOX_Congreso registró su primera Ley en @Congreso_Es: PL de protección integral de denunciantes de corrupción. En sus Disposiciones Finales reformamos la Ley de indultos para prohibirlos en delitos de rebelión y sedición. Mañana será un honor defenderla. https://t.co/QMYMJRnO7h,,,VOX,0.004159385338425636,0.002198508009314537,Unidas Podemos,0.005285709630697966,Cs,0.0024126849602907896,0.004337762016803026,0.0021120812743902206
1408887924385587207,"@MariscalZabala , al presidente de RTVE: ‘España no es una película de Almodóvar’. @VOX_Congreso   #SoloQuedaVox 
https://t.co/1h5tLsEEL9",emilio-jesus-del-valle-rodriguez,vox,VOX,0.0228816457092762,0.0007755635306239128,PODEMOS,0.1134960800409317,Cs,0.0008614864782430232,0.37944766879081726,0.0008429977460764349
1408888748142731270,"@Macarena_Olona responsabiliza a Marlaska de que la Generalidad retrasara la vacunación de los policías.  @VOX_Congreso #SoloQuedaVox 

 https://t.co/g5GB9HziE4",emilio-jesus-del-valle-rodriguez,vox,VOX,0.016998291015625,0.0010002237977460027,Unidas Podemos,0.04377547279000282,PSOE,0.001205664244480431,0.03557954356074333,0.0008200677111744881
1409265660941811715,"Así fue la respuesta de @AgustinRosety (VOX) al separatista que le insultó personalmente: 

https://t.co/W8EB2vLxtv",francisco-jose-contreras-pelaez,vox,VOX,0.07645620405673981,0.0008470364846289158,PODEMOS,0.8895490169525146,PODEMOS,0.0031771452631801367,0.30364927649497986,0.0010353594552725554
1409568039025139714,Ésto es @vox_es . #SoloQuedaVOX https://t.co/bd99xXrK6h,luis-gestoso-de-miguel,vox,VOX,0.008315644226968288,0.0015528943622484803,PODEMOS,0.04475599527359009,Cs,0.0016050401609390974,0.011204087175428867,0.0012115724384784698
1410158242433544196,"🤦‍♀️@pablocasado_: ""La guerra civil enfrentó a quienes querían democracia sin ley y quienes querían ley sin democracia"".

No conozco a ningún otro líder europeo que reivindique un golpe de estado fascista. Qué vergüenza este @populares arrastrado por VOX",joan-mena-arca,catalunya-en-comu,VOX,0.9971189498901367,0.9789968729019165,Unidas Podemos,0.9972460269927979,VOX,0.9789968729019165,0.9971910119056702,0.9518024325370789
1410533210702950400,"«Consideramos que no se está centrando el tema de la falta de nacimientos desde el ámbito natural donde nacen los niños y que es, además, donde está la solución: la familia»

La portavoz de VOX insistió en la crisis demográfica - Diario de Ávila https://t.co/23pyoqbMHn",,,VOX,0.009038472548127174,0.0012845767196267843,VOX,0.009038472548127174,Partido popular,0.0016824329504743218,0.006493260618299246,0.0015817838720977306
1410617740759420934,VOX acusa a Darias de seguir las mismas políticas de ‘confusión e irresponsabilidad’ que Illa en Sanidad https://t.co/It99gAfECo,juan-luis-steegmann-olmedillas,vox,VOX,0.9916302561759949,0.08749140799045563,VOX,0.9916302561759949,VOX,0.08749140799045563,0.9871513843536377,0.033049654215574265
1411274174346280960,Si tienes una empresa tienes que ver esto (Aizcorbe VOX) https://t.co/0rv2rxQnk0 a través de @YouTube,juan-jose-aizcorbe-torra,vox,VOX,0.010252220556139946,0.0019542481750249863,Unidas Podemos,0.163828507065773,VOX,0.0019542481750249863,0.23541077971458435,0.0019224268617108464
1411428414897205253,"“Una osadía infinita”. Artículo de Ignacio Gil Lázaro, Vicepresidente cuarto del Congreso de los Diputados por ⁦@VOX_Congreso⁩ #SoloQuedaVox https://t.co/tErSvwsfEb",emilio-jesus-del-valle-rodriguez,vox,VOX,0.009973771870136261,0.0011686867801472545,PODEMOS,0.017979061231017113,Cs,0.0016645588912069798,0.008975022472441196,0.001222931663505733
1412341424922705926,"Hasel en la cárcel pero el odio de VOX hacia los menas con bulos es libertad de expresión. Y así todo en la cúpula judicial española.
https://t.co/zicGANdGdv",jaume-asens-llodra,catalunya-en-comu,VOX,0.9891139268875122,0.0439889058470726,Partido popular,0.9955940842628479,Partido popular,0.38753774762153625,0.9923219084739685,0.08698321133852005
1412465210074484737,"VOX señala a El Jueves como los jihadistas a Charlie Hebdo y aquí no pasa nada. Ni #JeSuisElJueves ni un mísero breve en los principales medios.

Llega a hacer algo así @PODEMOS y abrimos los telediarios durante seis meses, nos ilegalizan y nos meten a todos en la cárcel. https://t.co/AcDeHROv2r",pablo-echenique-robba,podemos,VOX,0.996436595916748,0.9907163977622986,Unidas Podemos,0.9969363212585449,VOX,0.9907163977622986,0.9967128038406372,0.9829104542732239
1413086303370072065,Natalidad y reducción del paro y gasto político: la solución de VOX para garantizar las pensiones https://t.co/d01aaK78rt,juan-jose-aizcorbe-torra,vox,VOX,0.005528263747692108,0.001997135579586029,Unidas Podemos,0.006684771738946438,Cs,0.0023949164897203445,0.004835872445255518,0.0023021376691758633
1414518047650590720,"No es casualidad que Juan Carlos I lleve 345 días fugado a una dictadura árabe. Las conoce muy muy bien. Tan bien que es aún más escandaloso el bloqueo de PSOE, PP, VOX y Cs a investigar el emérito en el Congreso.
https://t.co/OtQmUJlx3w",jaume-asens-llodra,catalunya-en-comu,VOX,0.9849751591682434,0.02396394871175289,VOX,0.9849751591682434,VOX,0.02396394871175289,0.9725111722946167,0.011754749342799187
1414635201255415812,Con los hermanos cubanos apoyando su lucha por la libertad frente al comunismo. En la embajada cubana en Madrid con @hermanntertsch @monasterioR @Ortega_Smith @VOX_Congreso @vox_es https://t.co/WB3qo9sq9X,luis-gestoso-de-miguel,vox,VOX,0.00743328221142292,0.0013680389383807778,PODEMOS,0.019765393808484077,Cs,0.0014896300854161382,0.008253514766693115,0.0012367370072752237
1415057791761494022,"Video completo @VOX_Congreso en Comisión de Sanidad, frente a la Sra. Darias.  Steegmann Olmedillas, Juan Luis (GVOX) https://t.co/lS0ScduElG",juan-luis-steegmann-olmedillas,vox,VOX,0.0061136274598538876,0.0016778430435806513,Partido popular,0.011846806854009628,PSOE,0.0026348514948040247,0.006029337178915739,0.001666329219006002
1415257978643623936,"La ola negacionista. “Hay diputados de VOX que no se van a vacunar. En eso consiste la libertad”. 

 https://t.co/p2eT5zCcT3",anton-gomez-reino-varela,podemos,VOX,0.035587117075920105,0.0008579791174270213,Unidas Podemos,0.30121177434921265,Unidas Podemos,0.0008913360070437193,0.08336535096168518,0.0007128239376470447
1415757502633975808,"Los que hablan de ""poner un cordón sanitario a VOX"" sueñan con este (es el que han aplicado históricamente los comunistas): https://t.co/LBzvsshLTN",francisco-jose-contreras-pelaez,vox,VOX,0.9914289116859436,0.06188909336924553,Ciudadanos,0.9945269227027893,Ciudadanos,0.17734137177467346,0.985153317451477,0.02327209711074829
1416041899715072005,"🔴Importante:

💧Hemos registrado desde @VOX_Congreso esta iniciativa en defensa de un Plan Hidrológico Nacional que retome el trasvase del Ebro.

¡Solo queda VOX! https://t.co/AEDT5graDf",,,VOX,0.014249874278903008,0.0009806574089452624,Unidas Podemos,0.04662347584962845,Ciudadanos,0.0010677893878892064,0.013203572481870651,0.0010772999376058578
1417760054346924037,"VOX tiene el mismo discurso en toda España. 

💧Defendemos con la misma contundencia el trasvase del Ebro en Zaragoza y en Murcia.

https://t.co/SwYxd0ceWz",,,VOX,0.01854427345097065,0.0009592815767973661,PP,0.043337173759937286,Ciudadanos,0.0012953898403793573,0.027248935773968697,0.0009035788825713098
1418307754591195136,"Intervención Steegmann Olmedillas, Juan Luis (GVOX) en la Diputación Permanente del Congreso. 21-7-21 https://t.co/wFdzUP5vRh",juan-luis-steegmann-olmedillas,vox,VOX,0.0047635226510465145,0.002648480935022235,PODEMOS,0.6447997689247131,VOX,0.002648480935022235,0.006756212096661329,0.0018065657932311296
1418863107783409664,El Gobierno se negó a informarnos sobre los asesores enchufados a dedo en las Delegaciones del Gobierno. Lo denunciamos ante el TS. La Fiscalía concluye que se violaron los derechos del @VOX_Congreso. Obtendremos los datos. Y los haremos públicos. https://t.co/QGwqb1pewu,,,VOX,0.5080314874649048,0.0012760303216055036,Vox,0.5747819542884827,Partido popular,0.001478360267356038,0.5415528416633606,0.0014449091395363212
1418875279880110087,Nos han obsequiado con una carreta de estiércol. Supongo que en un momento se acercarán a arrojárnoslo. Mesa de VOX en Puenteareas: https://t.co/8pc1hDeOOx,francisco-jose-contreras-pelaez,vox,VOX,0.01428892370313406,0.0011563654989004135,PP,0.032986193895339966,VOX,0.0011563654989004135,0.045657478272914886,0.0007997261127457023
1419276624542027776,"Según el juez que te toque, esto de @lanuevaespana, riéndose, cual cuñado de VOX, de la gente que se juega la vida huyendo de la miseria y la guerra podría ser delito de odio o libertad de expresión.

Lo que seguro que es es pura miseria moral. https://t.co/uXW5GZgXXJ",pablo-echenique-robba,podemos,VOX,0.9967435598373413,0.8784003853797913,Unidas Podemos,0.9971146583557129,Unidas Podemos,0.9267058372497559,0.9958721995353699,0.5262637138366699
1419590023565950979,"VOX es el único partido que ha denunciado la torpe, caótica y roñosa compra de vacunas de la UE. Hemos unido nuestro destino a países que tienen menos infección y menos dependencia del turismo. Y así nos va.",juan-luis-steegmann-olmedillas,vox,VOX,0.9944964051246643,0.9955755472183228,Unidas Podemos,0.9959920048713684,VOX,0.9955755472183228,0.9952259063720703,0.994060218334198
1420707036795441156,"Casado dice que lo hicieron una vez y lo volverán a hacer
Quieren volver a precarizar el empleo
Quieren volver a privatizar la sanidad
Quieren volver para recortar derechos sociales
Quieren volver a cobrar sobresueldos
Quieren volver a financiarse en B
Y para eso cuentan con VOX",jose-zaragoza-alonso,psoe,VOX,0.9807215929031372,0.01714637130498886,Vox,0.981844425201416,Vox,0.01858297921717167,0.9728850722312927,0.011379387229681015
1421080287153434624,"Y se disparará aún más cuando los electores de los @populares se den cuenta de la inmensa distancia moral que les separa. Lo seguiremos explicando. 
#SoloQuedaVox 
@VOX_Congreso 
@vox_es  https://t.co/6DTY3yGY0k a través de @CorreodeEspana",maria-magdalena-nevado-del-campo,vox,VOX,0.011104300618171692,0.001076966873370111,PODEMOS,0.023729344829916954,PSOE,0.0012273805914446712,0.015216348692774773,0.0009330097236670554
1421803914903576578,"El bipartidismo ha generado durante décadas un entramado de intereses donde los principales defensores son la mayoría de los medios de comunicación. Todos comparten intereses propios, pagados por todos los españoles, y eso justifica los ataques a VOX",francisco-jose-alcaraz-martos,vox,VOX,0.9950927495956421,0.8442845940589905,VOX,0.9950927495956421,VOX,0.8442845940589905,0.9889786839485168,0.4157020151615143
1422458782140018699,"Desde @VOX_Congreso SÍ defenderemos a todos aquellos a los que se les niega la enseñanza en español en España. 

El Gobierno entierra la sentencia que garantiza un 25% de castellano en las escuelas de Cataluña @elmundoes https://t.co/LgKtXUmnxc",,,VOX,0.018040761351585388,0.0008981241844594479,Partido popular,0.024507276713848114,PSOE,0.0009380821138620377,0.01756330206990242,0.0009218993945978582
1422495894163820545,⁦@Jorgebuxade⁩ : “Ahora mismo el PP es cooperador necesario en la estrategia de deshumanización de VOX” | ⁦@vox_es⁩ #SoloQuedaVox  https://t.co/x5rYE8mqXo,emilio-jesus-del-valle-rodriguez,vox,VOX,0.9300856590270996,0.005309567786753178,Unidas Podemos,0.9655122756958008,Unidas Podemos,0.00867108628153801,0.8366142511367798,0.0027573376428335905
1422624496427622408,"El PP ha amagado  con imponer restricciones en la hostelería en varias comunidades, finalmente ha dado marcha atrás tras las advertencias de @vox_es con llevar el tema a la justicia.
Si no existiera VOX,  todo sería igual que lo vivido con el bipartidismo  durante décadas.",francisco-jose-alcaraz-martos,vox,VOX,0.309704452753067,0.0008256708388216794,PP,0.32439160346984863,PP,0.0008417623466812074,0.293948233127594,0.0008082098793238401
1422881569421807625,Sánchez y los asesinos de niños. Por ⁦@fjosealcaraz⁩ Diputado de ⁦@VOX_Congreso⁩  https://t.co/kpUXgXikYA,emilio-jesus-del-valle-rodriguez,vox,VOX,0.9925270080566406,0.9979991316795349,PSOE,0.9928346872329712,VOX,0.9979991316795349,0.9924805164337158,0.997967541217804
1423324466331930624,"#SoloQuedaVox 
👉Algunas Proposiciones no de Ley , @VOX_Congreso muchas de ellas rechazadas por los #progres. 

Reducir el IVA de las peluquerías, incluir a los ‘olvidados’ del Gobierno en los planes de ayuda… 10 iniciativas de VOX  https://t.co/e4ZB9CQXfM",ines-maria-canizares-pacheco,vox,VOX,0.01541425846517086,0.0010068934643641114,PP,0.025203131139278412,Partido popular,0.001171981100924313,0.016529230400919914,0.0010826215147972107
1423584117623566337,"Multimillonarios españoles financiaron el lanzamiento de VOX.

Si el primo segundo de uno de @PODEMOS se compra un coche caro, abre los telediarios. Pero esto no lo vas a ver en TV porque los mismos que financian a VOX controlan el poder mediático. https://t.co/8rsz0bHuRM",pablo-echenique-robba,podemos,VOX,0.9895886182785034,0.0571402981877327,Unidas Podemos,0.9926082491874695,Unidas Podemos,0.09389127045869827,0.9868621826171875,0.04145938530564308
1423695619881906179,"Los poderes mediáticos no dicen nada de la financiación franquista, iraní y de famosos multimillonarios para el lanzamiento de VOX no porque compartan intereses con ellos.

No seáis malpensados.

Es porque es un lío.

Por eso, vamos a difundir este esquema para echarles una mano. https://t.co/BomKPMEoB4",pablo-echenique-robba,podemos,VOX,0.9499297142028809,0.006888557691127062,Unidas Podemos,0.9797189235687256,Unidas Podemos,0.018403025344014168,0.9407854080200195,0.0060333567671477795
1424079490750242820,"Hoy hemos estado en #Cuenca apoyando a las asociaciones #PueblosconelTren y sus reivindicaciones.
Con el equipo de @VOX_Cuenca @IvanVelez72 afiliados y simpatizantes.
Más inversión y menos hipocresia en defensa de la #España olvidada por el Gobierno. 
#VoxUtil https://t.co/HNknv1O9hd",ines-maria-canizares-pacheco,vox,VOX,0.9904457330703735,0.06640151888132095,Ciudadanos,0.9938215017318726,Ciudadanos,0.2298392355442047,0.9933857321739197,0.2082679271697998
1425763383589097473,"#Los52deVOX continuamos luchando por la neutralidad en las instituciones, la independencia judicial, las víctimas del terrorismo y por nuestros agentes. #SoloQuedaVox https://t.co/tYFKVIMOBT",emilio-jesus-del-valle-rodriguez,vox,VOX,0.010494616813957691,0.0012719040969386697,Unidas Podemos,0.06113047897815704,Cs,0.0013059604680165648,0.018822098150849342,0.000982220284640789
1425775743565434885,@TwitterEspana sigue con la censura.Nos invisibiliza a los que no somos progres y nos quita cada día seguidores.Nos pasa a #Los52deVOX y a afiliados y simpatizantes a los que censuran y confiscan las cuentas cuando tuitean contra el consenso progre. @JavierPagan76 el nuevo censor https://t.co/LP80KvHKl3,luis-gestoso-de-miguel,vox,VOX,0.9904795289039612,0.053170233964920044,Unidas Podemos,0.9954416751861572,Unidas Podemos,0.22616319358348846,0.991312563419342,0.06593596190214157
1425903680365240323,"@VOX_Congreso lo advertimos. Una gran farsa, buscaban solo un titular. 

El fiasco de la ‘ley rider’: seguirán los autónomos y los líos judiciales https://t.co/eF2qmnGqyf vía @ABCeconomia",juan-jose-aizcorbe-torra,vox,VOX,0.9092638492584229,0.004047146998345852,Unidas Podemos,0.9355865120887756,Vox,0.0046142698265612125,0.9292134046554565,0.003982039168477058
